Certainly! Below is the updated timeline with all date ranges converted into numeric years (BCE/CE format):,,,,,,,,,,,,
,,,,,,,,,,,,
"Timeline of Solar Deities, Messiah Figures, and Covenant Gods: Evolution and Spread",,,,,,,,,,,,
Time Period (Years),Figure/Concept,Region/Culture,Key Attributes/Associations,Linguistic/Etymological Roots,Source Texts/Material Evidence,Spread/Influence,Notes/Citations,,,,,
1700 BCE – 1200 BCE,Proto-Indo-Iranian Sun God(s),Proto-Indo-Iranian,"Solar power, cosmic order, light",PIE root *sóh₂wl̥ (sun),"Comparative mythology, linguistic reconstruction",Proto-Indo-Iranian migrations,"Proto-solar worship, chariot imagery, foundational for later solar deities",,,,,
1500 BCE – 1000 BCE,Mitra (Vedic),India,"Covenant, friendship, light, contracts","PIE *mey- (to bind, to fix) → ""covenant""",Rigveda,Indo-Aryan migration into India,"Mitra as upholder of contracts, often with Varuna; solar and legal aspects",,,,,
1400 BCE – 1000 BCE,Haoma/Soma,Indo-Iranian,"Divine plant, immortality, light","Av. Haoma, Skt. Soma","Avesta, Rigveda","Ritual practices, religious ideas","Sacred intoxicant, personified as a deity, linked to ritual renewal",,,,,
1400 BCE – 1200 BCE,Shamash,Mesopotamia,"Sun god, justice, law","Akkadian ""šamaš"" (sun)","Cuneiform tablets, iconography",Mesopotamian empires,"Sun as divine judge, chariot imagery",,,,,
1300 BCE – 1000 BCE,"Ra, Aten",Egypt,"Sun god, creation, kingship, monotheism (Aten)","Egyptian ""Ra""","Pyramid texts, iconography",Egyptian state cult,"Atenism: early monotheism, solar disk worship",,,,,
1800 BCE – 1200 BCE,Baal Berith / El Berith,Canaan/Shechem,"Lord of the Covenant, protector of agreements, local god of Shechem","Hebrew: בַּעַל בְּרִית (""Baal of the Covenant"")","Judges 8:33, 9:4, 9:46; archaeology at Shechem","Canaanite and early Israelite religion, especially in Shechem","Temple at Shechem; associated with covenants, possibly linked to local treaties and alliances; later polemicized in biblical texts",,,,,
600 BCE – 500 BCE,Zarathustra (Zoroaster),Persia,"Prophet, ethical monotheism, light","""Possessing camels,"" ""golden light""",Gathas (Avesta),Zoroastrianism spread across Persia and Central Asia,Emphasized Ahura Mazda as supreme god of light; Mithra as divine judge,,,,,
600 BCE – 400 BCE,Mithra (Zoroastrian),Persia,"Covenant, light, justice, sun, contracts, afterlife",Proto-Iranian *Mitra (covenant),"Avesta (Yashts), Persian inscriptions","Royal ideology, religious syncretism","Yazata (angelic being), mediator, judge of souls, upholder of order",,,,,
300 BCE – 400 CE,Mithras (Greco-Roman),Roman Empire,"Sun god, initiation cult, cosmic power, tauroctony",Derived from Persian Mithra,"Mithraic temples, tauroctony iconography, inscriptions","Roman military, trade routes","Mystery cult, communal meals, Sunday worship, December 25th festival, solar monotheism",,,,,
1 CE – 500 CE,Amida Buddha (Amitābha),East Asia,"Infinite light, compassion, salvation, afterlife","Skt. Amitābha (""infinite light"")","Pure Land Sutras, statuary, temple art","Silk Road, Buddhist missionaries",Central to Pure Land Buddhism; promises rebirth in the Western Paradise; emphasis on light,,,,,
1 CE – Present,Maitreya,Pan-Asian (Buddhist),"Future Buddha, messianic figure, enlightenment, compassion","Skt. Maitreya (""loving-kindness"")","Buddhist Sutras (Maitreya Sutra), iconography","Buddhist monasticism, folk religion",Expected to appear in the future to renew the Dharma; savior figure; parallels to Mithra,,,,,
200 CE – 300 CE,Mani,Persia,"Prophet, dualism, light vs. darkness, savior",Syriac origin,"Manichaean scriptures, iconography",Manichaeism across Eurasia,"Syncretic: draws on Mithraic, Christian, Buddhist ideas; Mithra as savior guiding souls to light",,,,,
300 CE – 400 CE,Sol Invictus,Roman Empire,"Unconquered Sun, state cult, December 25 festival","Latin ""Sol Invictus""","Inscriptions, Philocalian Calendar","Roman state, Christianity",Festival date and iconography absorbed into Christian tradition as Christmas,,,,,
300 CE – 600 CE,Christ as Solar Figure,Christian Rome,"Light of the world, cosmic ruler, resurrection, Sunday worship","Greek ""Christos"" (anointed)","Early Christian art (charioteer mosaics), writings",Christianization of Empire,"Christ depicted with solar attributes, such as a radiant nimbus or chariot, echoing Sol Invictus and Mithras",,,,,
700 CE – 1000 CE,Maitreya-Mithra Syncretism,"Central Asia, Silk Road","Savior, light, cosmic renewal",Merged forms,"Buddhist and Manichaean texts, art",Silk Road syncretism,Some traditions merge or parallel Maitreya and Mithra as savior figures,,,,,
1800 CE – 2000 CE,Modern Solar Messiahs,Global,"Spiritual leaders, solar/renewal symbolism",Context-dependent,"New religious movements, literature",Globalization,"Examples: Baha'u'llah (Baha'i), New Age figures, continued solar motifs",,,,,
,,,,,,,,,,,,
"If you'd like, I can also provide a downloadable version or format this for a specific use!",,,,,,,,,,,,
,,,,,,,,,,,,
Answer from Perplexity: pplx.ai/share,,,,,,,,,,,,
