Date_Label,Date_Sort,Tradition_System,Sub_Tradition,Entry_Type,Title_Event,Person_Visionary,Location,Source_Text,Description,Key_Motifs,Parallel_Systems,Scholarly_Source,Evidence_Tier,Notes
"c. 1000–1100 CE",1050,Kundalini/Subtle Body,Tibetan Buddhism / Vajrayana,Text,Naropa's Six Yogas – Tummo (Inner Heat) and Subtle Body System,"Naropa (1016–1100 CE); Tilopa (988–1069 CE)",India / Tibet,"Six Yogas of Naropa (transmission from Tilopa; texts compiled from c. 1050 CE onward)","Tummo (inner heat) yoga: visualization of central channel (avadhuti); red-hot coals at navel; kundalini-equivalent (thigle / bindu) rising through chakras; goal: luminous awareness; Illusory Body yoga; Dream yoga; Clear Light yoga; Ejection of consciousness (phowa); Bardo yoga; parallel to Hindu kundalini system through shared Tantric substrate","Inner heat; central channel; chakras (4 main in Buddhist system); thigle/bindu; luminous awareness; dream yoga; clear light","Kundalini (Tummo = Buddhist kundalini; same substrate of Vajrayana tantra); Hekhalot (ascent through stages to divine light = Tummo ascent through chakras to crown clear light – Tier C); Meditation Timeline (Six Yogas of Naropa)","Evans-Wentz, 'Tibetan Yoga and Secret Doctrines' (1935); Mullin, 'The Six Yogas of Naropa' (2005); Germano, 'Architecture and Absence in the Secret Tantric History of rDzogs Chen' (1994)",A,"Six Yogas of Naropa = Buddhist parallel to Hindu kundalini; both systems share Vajrayana Tantric substrate; strongest Buddhist-Kundalini parallel"
"c. 1280 CE",1280,Hekhalot/Merkabah,Medieval Kabbalah,Comparative Note,Seven Sefirot (Lower) as Functional Parallel to Seven Hekhalot Halls,Moses de León / Kabbalistic tradition,Castile (Spain),"Zohar Volumes (1280–1286 CE); Sefer Yetzirah (7th–10th c. CE re-edited)","The seven lower sefirot in the Zoharic Kabbalah (Chesed-Gevurah-Tiferet-Netzach-Hod-Yesod-Malkhut) map functionally onto the seven Hekhalot halls; the soul ascends through the sefirot toward Ein Sof (Infinite) just as the Merkabah mystic ascends through the seven halls toward the divine throne; Zohar's devotional-ecstatic character adds emotional dimension","Seven lower sefirot; soul's ascent; Ein Sof as goal; Shekhinah at base; Keter at crown; four worlds","Hekhalot (Zohar directly inherits and transforms seven-hall structure); Kundalini (seven sefirot / seven chakras parallel is extensively discussed in modern comparative mysticism – Tier C); OT Visions (Torah as encoded vision text in Zoharic reading)","Scholem, 'On the Mystical Shape of the Godhead' (1991) pp. 37–69; Idel, 'Kabbalah: New Perspectives' (1988) ch. 5; Wolfson, 'Through a Speculum That Shines' (1994)",A,"Sefirot → hekhalot continuity is Tier A; sefirot / chakras parallel is cited in comparative literature (Tier C)"
"c. 1750–1810 CE",1780,Hekhalot/Merkabah,Hasidic Judaism,School,Baal Shem Tov and Hasidism – Democratization of Merkabah Mysticism,"Israel Baal Shem Tov (Besht, 1698–1760 CE); disciples","Podolia (Ukraine); Galicia; Poland","Shivhei ha-Besht (In Praise of the Baal Shem Tov; 1814 ed.); Hasidic Torah commentaries","Baal Shem Tov's heavenly ascent narratives; democratization of Merkabah mysticism from elite yordei hamerkavah to communal ecstatic prayer; devekut (cleaving to God) as accessible practice; niggun (wordless song) as vehicle for ascent – parallel to Hekhalot hymns; soul-ascent narratives in Hasidic literature","Devekut (cleaving); ecstatic prayer; niggun (wordless melody); soul ascent; democratization of mysticism","Hekhalot (same ascent tradition but democratized; niggun parallel to Hekhalot hymns as sonic vehicle); Zohar (Kabbalistic framework continued); Kundalini (both kundalini and devekut are inner-ascent traditions now available outside elite lineage)","Scholem, 'Major Trends in Jewish Mysticism' (1941) ch. 9; Idel, 'Hasidism: Between Ecstasy and Magic' (1995); Green, 'Devotion and Commandment' (1989)",A,"Hasidism transformed Merkabah/Hekhalot from elite practice to popular devotion; niggun as ascent technology directly parallels Hekhalot hymns"
"Structural Analysis",0,Cross-Traditional,Structural Comparison,Comparative Note,Seven Stages: Hekhalot Halls vs. Seven Chakras vs. Seven Sefirot – Convergent Architecture,"Scholars' comparative observation","Palestine/Babylonia vs. Kashmir vs. Spain","Hekhalot Rabbati; Abhinavagupta's Tantrāloka; Zohar; Hatha Yoga Pradipika","ALL THREE major traditions describe a sevenfold ascent from lower to higher: (1) Hekhalot: 7 halls from earthly entry to divine throne; guardians/tests at each; purification required; goal = union with divine; (2) Kundalini: 7 chakras from muladhara (base/earth) to sahasrara (crown/divine); blockages at each; purification required; goal = Shiva-Shakti union; (3) Kabbalah: 7 lower sefirot from Malkhut (earth) to Keter (crown/Ein Sof); each sefirah requires contemplation; goal = devekut/union; structural convergence suggests either genealogical connection or deep cross-cultural pattern","Seven stages; guardian/obstacle at each; purification required; graded ascent; divine union at culmination; lower=earth/base; upper=divine/crown","All three traditions compared; OT Visions (seven levels of heaven in prophetic tradition; temple courts as graded approach to Holy of Holies)","Scholem, 'On the Mystical Shape of the Godhead' (1991) ch. 2; Idel, 'Kabbalah: New Perspectives' (1988) pp. 103–111; Feuerstein, 'The Yoga Tradition' (1998) pp. 382–388; Wolfson, 'Through a Speculum That Shines' (1994) pp. 270–275",C,"STRUCTURAL parallel only; no proven genealogical connection between Hekhalot and Kundalini; convergent evolution of mystical systems drawing on universal contemplative architecture is the most defensible position. Tier C for causal claims; Tier A for structural observation"
"c. 4000–3000 BCE","-4000","Eurasian Precursor","Mesopotamian (Sumerian)","Origin Marker","Sumerian Sacred Tree and World Pillar – Eridu Cosmogony (Kigkanu)","Anonymous Sumerian tradition","Eridu / Nippur (Sumer)","CT 16 46:183ff.; Widengren 'The King and the Tree of Life' (Uppsala 1951)","Black kigkanu tree in Eridu: 'created in a holy place; its sheen is pure lapis lazuli drawing from the Apsu'; the World Pillar (Dur-an-ki = Bond of Heaven and Earth) as the cosmic axis; Eridu as navel of the world; apkallu sages tend the tree; tree links heaven, earth, and underworld. Earliest textual record of a named sacred tree in any tradition.","World tree; cosmic axis; lapis lazuli; apkallu sages; underworld waters; Apsu; navel of world","Hekhalot (heavenly palaces rooted in same cosmic-axis theology); Kundalini (spine/sushumna as cosmic axis – Tier C); OT Visions (Jacob's ladder; Ezekiel kavod above firmament)","Parpola, 'The Assyrian Tree of Life' JNES 52/3 (1993) pp. 163–164; Widengren (1951); Lambert, BSOAS 48 (1985)","B","Earliest textual reference to a named sacred tree in Mesopotamia; prototype for all subsequent Mesopotamian sacred tree iconography"
"c. 2500–1243 BCE","-2500","Eurasian Precursor","Mesopotamian (Assyrian/Babylonian)","Origin Marker","Pre-Assyrian Sacred Tree – Triadic Nodes and Flanking Figures Across the Near Eastern Oikumene","Neo-Sumerian through Mitannian traditions","Mesopotamia (Assur; Nippur; Babylon) → Egypt → Greece → Indus","Cylinder seals; Mitannian seals 14th c. BCE; Kepinski 'L'Arbre stylisé en Asie occidentale au 2e millénaire' (Paris 1982)","Stylized tree motif from 4th millennium BCE; by the 2nd millennium found throughout the Near Eastern oikumene including Egypt, Greece, and the Indus Valley. Characterized by triadic trunk, palmette crown, flanking animals (ibexes, goats, eagles). Harappan forms show Proto-Elamite and Akkadian influence. Earliest Greek examples (15th c. BCE) are 'pronouncedly Babylonian' (Parpola). Egyptian examples arrived via Hyksos from 16th c. BCE.","Stylized tree; triadic trunk nodes; flanking animals; palmette crown; spread to Egypt / Greece / Indus","Hekhalot (angelic flanking figures at each hall); Kundalini (three-columned trunk = ida/pingala/sushumna – Tier C); OT Visions (Asherah; Eden tree)","Parpola JNES 52/3 (1993) pp. 161–163; Kepinski (1982); Danthine 'Le Palmier-dattier et les arbres sacrés' (Paris 1937)","A","By the Middle Bronze Age the sacred tree is the dominant religious icon of the entire Near East; spread confirmed to the Indus Valley predating Vedic India"
"c. 1243 BCE","-1243","Eurasian Precursor","Neo-Assyrian Imperial","Origin Marker","Neo-Assyrian Sacred Tree Diagram – Ten-Node Sefirotic Prototype (Tukulti-Ninurta I)","Tukulti-Ninurta I (king); Assyrian court scholars","Kar-Tukulti-Ninurta / Assur (Assyria)","Seal impression KAJ 144 (dated to Tukulti-Ninurta I eponymy); wall paintings of Kar-Tukulti-Ninurta; Parpola JNES 52/3 (1993)","The canonical Late Assyrian Tree first appears under Tukulti-Ninurta I: trunk with three triadic nodes (each with two flanking circles = 3×3 = 9 nodes plus crown = 10 total); winged disk (Assur = En Sof) hovering above; flanking king or apkallu figures; pomegranate/pinecone garland symbolizing 'unity in multiplicity'; tripartite trunk = three pillars of Kabbalah. Parpola demonstrates this diagram is structurally identical to the Kabbalistic Sefirotic Tree when Mesopotamian gods replace the Sefirot.","Three triadic nodes; winged disk above (En Sof / Assur); three-columned trunk; pomegranate garland; 10-point structure; flanking figures; tripartite pillars","Hekhalot (same ten divine attributes structure the angelic hierarchy); Kabbalah (Sefirotic Tree = direct adaptation – Parpola's main thesis); Kundalini (10-node vs. 7-chakra structural comparison – Tier C)","Parpola JNES 52/3 (1993) pp. 163–176 and fig. 7 (reconstructed Tree); Beran ZA 47–52; Moortgat ZA 48 (1944)","A","CRITICAL FINDING (Parpola): mystic numbers of Mesopotamian gods (Anu=1; Ea=60; Sin=30; Samas=20; Marduk=50; Ishtar=15; Ninurta/Nabu=50; Adad=10; Nergal=14) map exactly onto Sefirotic positions — his proof of direct Mesopotamian→Kabbalah transmission"
"c. 1243 BCE","-1242","Eurasian Precursor","Neo-Assyrian Esoteric","Comparative Note","Parpola's Mapping: Mesopotamian Gods → Kabbalistic Sefirot (JNES 1993 fig. 7)","Simo Parpola (1993 reconstruction)","Assur / Nippur / Babylonia","Parpola JNES 52/3 (1993) pp. 176–182 and fig. 7; Tallqvist 'Akkadische Götterepitheta' (Helsinki 1938)","Parpola places Mesopotamian gods in the ten Sefirotic positions: KETER=Anu (Heaven; #1; father of gods); HOKHMAH=Ea/Enki (wisdom; #60; 'sage of gods; lord of secrets'); BINAH=Sin/Moon (deep intellect; #30; 'whose counsel nobody perceives'); HESED=Marduk (merciful father; #50); DIN/GEVURAH=Shamash (divine judge; #20); TIFERET=Ishtar/Venus (beauty/love; #15); NETZAH=Ninurta/Nabu (victory warrior; #50/10); HOD=Adad/Girru (storm splendor; #10); YESOD=Nergal (strength/foundation; #14); MALKHUT=the king (distributor of the divine stream). Biblical evidence: 1 Chr 29:11 lists gedullah-gevurah-tiferet-nezah-hod in exact Sefirotic diagram order.","Keter=Anu; Hokhmah=Ea; Binah=Sin; Hesed=Marduk; Gevurah=Shamash; Tiferet=Ishtar; Netzah=Ninurta/Nabu; Hod=Adad; Yesod=Nergal; Malkhut=king","Hekhalot (angelic names ending in -EL mirror Mesopotamian divine names in same positions); OT Visions (1 Chr 29:11 David's blessing enumerates five Sefirot in order); Kabbalah (direct ancestral model)","Parpola JNES 52/3 (1993) pp. 176–182; Scholem 'Origins of the Kabbalah' (1987); Idel 'Kabbalah: New Perspectives' (1988)","A","Parpola's reconstruction is the strongest published case for Mesopotamian origin of the Sefirot; 1 Chr 29:11 Sefirotic sequence = biblical-level evidence (Tier A)"
"c. 1200–600 BCE","-1200","Eurasian Precursor","Mesopotamian (Babylonian)","Text","Enuma Elish – Sacred Tree Cosmogony as Encoded Mathematical Theogony","Anonymous Babylonian scholars; canonical version c. 1200 BCE","Babylon / Nippur","Enuma Elish Tablets I–VII; Lambert & Millard ed. (1969); Parpola JNES 52/3 (1993) pp. 190–191","Parpola demonstrates Enuma Elish encodes the Tree diagram: Apsu + Mummu + Tiamat = primordial undifferentiated unity (En Sof equivalent); Lahmu/Lahamu = binary system of oppositions; Anshar = Assur = the Infinite Light; Anu emanated as Anshar's 'mirror' (not created, but reflected); mystic numbers of gods embedded in narrative sequence. The theogony is a mathematical process encoded in mythological language. Parpola explicitly compares Apsu-Tiamat to Shiva-Shakti in primordial union: 'the metaphysical propositions of Tantra are stated in very similar terms.'","Mathematical cosmogony; binary oppositions; emanation not creation; primordial zero; Anshar as Endless Light; Apsu-Tiamat = Shiva-Shakti","Hekhalot (same divine council structure); Kabbalah (En Sof parallel to Anshar); Kundalini (Apsu-Tiamat = Shiva-Shakti primordial undivided consciousness – Parpola's own explicit comparison; Tier B)","Parpola JNES 52/3 (1993) pp. 190–191 and nn. 109–116; Wallis 'Neoplatonism' (1972) pp. 47–72","B","Parpola's mathematical reading is speculative but internally consistent; the Tantra comparison is Parpola's own (not a New Age overlay); mystic number sequences are independently verifiable (Tier A for numbers; Tier B for cosmogonic interpretation)"
"c. 2100–600 BCE","-1800","Eurasian Precursor","Mesopotamian (Babylonian)","Text","Gilgamesh Epic – Tree Diagram as Structural Map of Mystical Ascent (Parpola)","Anonymous; canonical version by Sin-leqi-unninni c. 1200 BCE","Uruk / Nippur / Nineveh","Standard Babylonian Gilgamesh Epic (George, OUP 2003); Parpola JNES 52/3 (1993) pp. 192–195","Parpola argues the 12-tablet Gilgamesh Epic is structured after the Sefirotic Tree (each tablet = one node); Tablets I–VIII = soul development through lower Sefirot; Tablet IX = passage through Daat (void before divine union; the dark-mountain passage); Tablets X–XI = cosmic knowledge journey; Tablet XII = Crown (Anu) = mystical reunion with Enkidu and secrets of the afterlife. The Epic's hidden 'secret' = the same 'secret of the world' later revealed in Hekhalot Rabbati. The 'walls of Uruk' = the Tree as structural diagram; the 'lapis lazuli tablet' = the hidden esoteric key.","12 tablets = 12 Sefirotic positions; Tablet IX = Daat void; lapis lazuli tablet; secret of immortality; gates and walls; passage through darkness","Hekhalot (Hekhalot Rabbati = same 'ascent to heaven' secret Gilgamesh obtains); OT Visions (Daniel's cosmic journey; Ezekiel's ascent); Kundalini (journey through dangers = kundalini obstacles at each chakra – Tier C)","Parpola JNES 52/3 (1993) pp. 192–195; George 'The Babylonian Gilgamesh Epic' (OUP 2003); Idel 'Kabbalah: New Perspectives' (1988) pp. 88–94","B","Parpola's structural reading is a minority scholarly view; his linkage of Gilgamesh's 'secret' to Hekhalot's 'secret of the world' is his most important insight connecting Mesopotamian narrative to Jewish mystical practice"
"c. 2600–1200 BCE","-2600","Eurasian Precursor","Mesopotamian (Sumerian/Akkadian)","Text","Etana Myth – Eagle Ascent as Earliest Recorded Heavenly Ascent Narrative","Etana (mythological king of Kish)","Kish / Nippur (Sumer / Akkad)","Etana Myth (Kinnier Wilson, 'The Legend of Etana' 1985); Parpola JNES 52/3 (1993) pp. 195–200","Etana ascends to heaven on the back of an eagle through seven heaven levels to retrieve the 'plant of birth'; earth shrinks to a point as they ascend. Parpola links this to the Merkabah tradition: eagle = divine chariot; plant of birth = the Tree; ascent for the birth-secret = Hekhalot ascent for divine secrets. In Ishtar's vision within the myth the eagle is described as a beautiful winged man – identified by Parpola with the Sefirah Tiferet/Ishtar.","Eagle as chariot; seven-level ascent; earth shrinking below; divine secret retrieval; plant of birth; Ishtar vision of the eagle-man","Hekhalot (eagle chariot = Merkabah; Etana's ascent = prototype of Jewish heavenly ascent – Tier B); OT Visions (Elijah's chariot; Ezekiel's Merkabah); Kundalini (eagle = Garuda vehicle of Vishnu in kundalini iconography – Tier C)","Parpola JNES 52/3 (1993) pp. 195–200; Kinnier Wilson 'The Legend of Etana' (1985)","B","Etana myth = earliest known narrative of heavenly ascent (c. 2600 BCE tradition); eagle-vehicle is pan-Eurasian (Garuda; Zeus's eagle; Horus-falcon; Simurgh); Parpola proves the Ishtar-Tiferet identification within the myth itself"
"c. 900–612 BCE","-900","Eurasian Precursor","Neo-Assyrian Imperial","Transmission","Neo-Assyrian Tree Doctrine Spreads to Vassal Territories – Six Post-Assyrian Daughter-Systems","Assyrian court scholars (ummanu); scribes; prophets","Nineveh / Calah / Dur-Sharrukin → vassal territories (Judah; Persia; Greece; Babylonia)","Parpola JNES 52/3 (1993) pp. 189–190; SAA 3; 1 Chr 29:11 (biblical evidence)","After the fall of the Assyrian empire (612 BCE) the Tree's religious ideas spread to former vassals; Parpola identifies six 'new religions' emerging simultaneously after Assyrian collapse: (1) Zoroastrianism (Persia); (2) Pythagoreanism (Greece); (3) Orphism (Greece); (4) Platonism (Greece); (5) Jewish monotheism (Babylonian exile); (6) Kabbalah via Babylonian rabbinical schools. Neoplatonists Plotinus and Porphyry themselves said Pythagorean and Platonic teachings came from 'the East.' Biblical passage 1 Chr 29:11 enumerates five Sefirotic names in exact Sefirotic diagram order — biblical-level documentation of the diagram's absorption into Hebrew theology.","Post-Assyrian transmission; six daughter-traditions; Babylonian exile as conduit; oral tradition preserved; Achaemenid absorption of Assyrian symbolism","Hekhalot (Babylonian rabbinical schools = direct conduit for Merkabah mysticism); Kabbalah (transmitted via Aaron ben Samuel of Babylonia to Italy, 870 CE); Zoroastrianism (dualist Tree pillars); Greek philosophy (Pythagorean sacred numbers = Mesopotamian divine numbers)","Parpola JNES 52/3 (1993) pp. 189–190; Scholem 'Major Trends in Jewish Mysticism' (1941); Burkert 'The Orientalizing Revolution' (1992)","B","Six philosophical-religious systems simultaneously emerging after Assyrian collapse is historically striking; Babylonian exile → Kabbalah is Tier A; Pythagorean-Platonic connection is Tier B; all six systems share a ten-attribute divine structure"
"c. 3100–332 BCE","-3100","Eurasian Precursor","Egyptian","Origin Marker","Egyptian Djed Pillar – Backbone of Osiris / Vertical Energy Column","Osirian cult; pharaonic tradition","Memphis / Abydos / Heliopolis (Egypt)","Pyramid Texts c. 2400 BCE; Book of the Dead; Djed raising ceremony; Clark 'Myth and Symbol in Ancient Egypt' (1959)","The Djed pillar (Dd) = 'stability; backbone of Osiris'; raised annually in the Djed ceremony at Memphis; represents the spinal column of the cosmic god Osiris; four horizontal bands (vertebrae/stacked rings); raises the deceased to immortality; vertical axis linking earth to heaven. The Djed as structural parallel to the sushumna nadi (central channel) and stupa spire — the ritual raising of the Djed spine IS the Egyptian equivalent of kundalini activation.","Djed pillar; Osiris backbone; four horizontal bands; stability; immortality; vertical axis; raising ceremony","Kundalini (Djed = backbone/spine = sushumna; four bands as proto-chakra levels – Tier C); Hekhalot (vertical axis linking realms = seven-hall vertical axis); OT Visions (Moses' brazen serpent Nehushtan; brazen pillar)","Clark 'Myth and Symbol in Ancient Egypt' (1959) pp. 239–243; Budge 'Osiris and the Egyptian Resurrection' (1911); Reymond 'The Mythical Origin of the Egyptian Temple' (1969)","B","Djed as kundalini spine is Tier C for the causal parallel; Djed as axis mundi / immortality symbol is Tier A in Egyptian context; four bands as proto-chakra markers is Tier C"
"c. 3000–1500 BCE","-3000","Eurasian Precursor","Egyptian","Origin Marker","Egyptian Nine Body-Souls (Ka / Ba / Akh / Sahu / Sekhem) – Subtle Body System","Egyptian funerary tradition","Heliopolis / Memphis / Thebes (Egypt)","Pyramid Texts; Coffin Texts; Book of the Dead; Assmann 'Death and Salvation in Ancient Egypt' (Cornell UP 2005)","Egyptian nine-body system: Khat (physical body); Ka (vital double = prana/life-force); Ba (individual soul-bird that ascends; personal divine faculty); Akh (luminous transfigured spirit = goal of transformation); Sahu (spiritual body); Sekhem (power-body); Ren (true name); Ib (heart-soul); Khaibit (shadow). System of ascending transformation from physical to luminous body: Ka=prana; Ba=individual soul; Akh=enlightened luminous state = sahasrara parallel. Most sophisticated ancient subtle-body system outside India.","Ka (vital double/prana); Ba (soul-bird ascent); Akh (luminous spirit); Sahu (spiritual body); nine body-souls; ascending transformation; luminous goal","Kundalini (Ka=prana; Akh=luminous awakening at sahasrara – Tier B); Hekhalot (Enoch/Metatron transformation into luminous angelic form = Akh process – Tier A parallel); Meditation Timeline","Assmann 'Death and Salvation in Ancient Egypt' (Cornell UP 2005); Hornung 'Conceptions of God in Ancient Egypt' (1982); Quirke 'Ancient Egyptian Religion' (1992)","B","Nine Egyptian body-souls = most sophisticated ancient subtle-body system outside India; Ka-prana and Akh-sahasrara parallels are Tier B; nine bodies vs. seven chakras requires caution in cross-cultural comparison"
"c. 1500–500 BCE","-1500","Kundalini/Subtle Body","Vedic (Five Elements / Tattvas)","Origin Marker","Pancha Mahabhutas + Five Tattva Geometric Shapes – Foundations of Kundalini and Stupa Design","Vedic rishis; codified in Samkhya and Tantric traditions","Northern India","Taittiriya Upanishad 2.1–5; Samkhya Karika; Tantric tattva texts; Rigveda (Mahabhuta proto-references)","The five primordial elements (Pancha Mahabhutas) are paired with five geometric tattva shapes: (1) PRITHVI/Earth = yellow square = muladhara chakra = solidity; (2) APAS/Water = silver crescent = svadhisthana = fluidity; (3) AGNI/Fire = red upward triangle = manipura = transformation; (4) VAYU/Air = blue circle = anahata = movement; (5) AKASHA/Space = black bindu point or egg = vishuddha = pure vibration/sound. These five shapes simultaneously define: (a) the five lower chakras; (b) the five architectural levels of the stupa; (c) the Vedic cosmological elements; (d) the system of tactile/visual tattva meditation for kundalini activation. Direct structural parallel to Plato's five regular solids in the Timaeus.","Yellow square (earth/muladhara); silver crescent (water/svadhisthana); red triangle (fire/manipura); blue circle (air/anahata); black bindu point (space/vishuddha); five geometric forms; chakra correspondence","Kundalini (each tattva governs a specific chakra; tattva visualization = primary kundalini activation technique); Stupa design (five tattva shapes = five stupa architectural levels – CRITICAL link); Platonic Solids (Plato's five regular solids = Greek parallel to the same five-element geometry); Hekhalot (five-element material world = substrate of lower Sefirotic levels)","Feuerstein 'The Yoga Tradition' (1998) pp. 108–114; Avalon/Woodroffe 'The Serpent Power' (1919) ch. 3; Zimmer 'Myths and Symbols in Indian Art and Civilization' (1946); Taittiriya Upanishad 2.1–5","A","THE foundational Vedic subtle-body / cosmic-element system; every subsequent kundalini and stupa system builds on this five-shape framework; tattva geometric forms attested in Tantric iconography from c. 800 CE onward but philosophical basis is Vedic; structural parallel to Platonic five solids is Tier A; causal link is Tier B–C"
"c. 500–100 BCE","-400","Kundalini/Subtle Body","Buddhist / Vedic Architectural","Origin Marker","Stupa as Verticalized Five-Element Cosmos – Pancha Dhatu Architecture (Snodgrass)","Ashoka and subsequent Buddhist traditions; architects","India (Sanchi; Amaravati; Bharhut); later Tibet; Java; Sri Lanka","Drimed Namnyiy (Tibetan canonical stupa symbolism); Snodgrass 'The Symbolism of the Stupa' (Cornell SEAP 1985)","The stupa IS the five Vedic elements and five tattva shapes stacked vertically as a complete cosmology and subtle body: (1) SQUARE BASE = Prithvi/Earth = yellow = muladhara = foundation; (2) SPHERICAL DOME (anda) = Apas/Water = white = cosmic egg/womb = svadhisthana; (3) TRIANGULAR/CONICAL HARMIKA SPIRE = Agni/Fire = red = transformation = manipura; (4) CRESCENT CANOPY = Vayu/Air = blue = liberation = anahata; (5) CIRCULAR FINIAL / BINDU POINT = Akasha/Space = pure consciousness = vishuddha/sahasrara. The entire stupa = an externalized meditating Buddha's body; the Buddha's relics inside = inner fire of enlightenment; circumambulation (pradakshina) = activating the energy body around the central axis.","Square base (earth/muladhara); dome/anda (water/svadhisthana); spire/harmika (fire/manipura); crescent canopy (air/anahata); apex bindu (space/sahasrara); five elements stacked; cosmic egg; relics = inner fire; circumambulation = energy activation","Kundalini (stupa = exteriorized five-chakra body; five levels = five lower chakras; finial = sahasrara – Tier B); Vedic Mahabhutas (direct application of tattva system); Platonic Solids (same five-element hierarchy from earth-cube to aether-point); Mesopotamian Tree (stupa = Buddhist tree-of-life equivalent; axis mundi function identical)","Snodgrass 'The Symbolism of the Stupa' (Cornell SEAP 1985) – definitive; Beer 'The Handbook of Tibetan Buddhist Symbols' (2003) ch. 4; Zimmer 'Myths and Symbols in Indian Art and Civilization' (1946) pp. 140–162; Coomaraswamy 'The Origin of the Buddha Image' (1927)","A","Snodgrass (1985) is the authoritative source establishing stupa-as-five-elements; the five-tattva-shape architectural system is unambiguously documented (Tier A); the kundalini-stupa parallel is Tier B and discussed in modern comparative scholarship"
