Date_Label,Date_Sort,Tradition_System,Sub_Tradition,Entry_Type,Title_Event,Person_Visionary,Location,Source_Text,Description,Key_Motifs,Parallel_Systems,Scholarly_Source,Evidence_Tier,Notes
"c. 300–100 BCE","-200","Kundalini/Subtle Body","Buddhist Tantric","Comparative Note","Stupa Yasti (Inner Axis Pillar) and Chattravali (Ring Spire) – Buddhist Subtle-Body Column","Buddhist Tantric tradition","India / Tibet / Central Asia","Snodgrass 'The Symbolism of the Stupa' (1985) pp. 295–310; Beer 'Handbook of Tibetan Buddhist Symbols' (2003)","The stupa's central pillar (yasti = 'life-tree') runs from foundation to apex through the dome; above the dome rises the chattravali: a stack of rings/discs (13 in Tibetan tradition = 13 stages to enlightenment: 10 bhumi + 3 special states); the inner axis pillar = sushumna; the rings = the chakra column; circumambulation mimics kundalini circling the central channel; the entire stupa IS a three-dimensional visualization of the subtle body standing upright with spine extended. Yasti = sushumna; chattravali = chakras ascending to the crown bindu.","Yasti (inner axis pillar = sushumna); chattravali (13 rings = chakra/bhumi column); circumambulation; bhumi stages; inner life-tree; three-dimensional subtle body visualization","Kundalini (yasti = sushumna; chattravali rings = chakra column – Tier B; most direct architectural kundalini parallel); Hekhalot (13-stage ascent parallel to seven halls); Five Elements (stupa lower five = tattvas; upper rings = stages beyond material elements)","Snodgrass 'The Symbolism of the Stupa' (1985) pp. 295–310; Beer 'The Handbook of Tibetan Buddhist Symbols' (2003) pp. 215–225","B","Yasti/chattravali as subtle body column documented in Tibetan canonical texts (Tier A for Buddhist meaning); 13 rings = specific bhumi stages (Tier A); kundalini-spine parallel is Tier B"
"c. 1000–700 BCE","-900","Eurasian Precursor","Iranian / Avestan","Origin Marker","Haoma Tree / Gaokerena – Zoroastrian Cosmic Axis (Post-Assyrian System per Parpola)","Zarathustra / Zoroastrian tradition","Eastern Iran (Airyana Vaejah / Bactria)","Avesta: Yasna 9–11 (Haoma hymns); Vendidad; Bundahishn; Boyce 'A History of Zoroastrianism' vol. 1 (1975)","White Haoma tree (Gaokerena) grows in the Vourakasha sea at the center of the world; the Saena/Simurgh bird nests at the crown; eating Haoma grants immortality and resurrection; cosmic axis connecting heaven and earth; a second tree (Asha-sp = 'tree of all seeds') disperses all plants; the serpent of Ahriman (evil) attacks the root but is repelled by the kar-fish. Structurally identical to the Assyrian Tree (eagle at top; serpent at root; cosmic sea; immortality function) and Norse Yggdrasil. Parpola identifies Zoroastrianism as a direct post-Assyrian outgrowth of the Tree theology.","White Haoma tree; Vourakasha cosmic sea; Saena/Simurgh at crown; serpent at root; immortality; cosmic axis; seeds of all plants; kar-fish protector","Mesopotamian Tree (Haoma = direct parallel to Eridu kigkanu in cosmic sea; both grant immortality – Tier A structural connection); OT Visions (Eden Tree of Life); Kundalini (Haoma ritual = ecstatic pranic awakening – Tier C); Norse Yggdrasil (eagle-crown/serpent-root = identical three-world motif); Steppe World Tree","Boyce 'A History of Zoroastrianism' vol. 1 (1975) pp. 156–160; Gnoli 'Zoroaster's Time and Homeland' (1980); Parpola JNES 52/3 (1993) p. 189 (Zoroastrianism as post-Assyrian outgrowth)","A","Haoma tree = white axis mundi with Simurgh (eagle) at crown and serpent at root = structurally identical to pan-Eurasian world-tree pattern; haoma/soma ritual = earliest documented entheogenic-ecstatic tradition in Eurasia; Parpola places Zoroastrianism as direct post-Assyrian outgrowth"
"c. 570–350 BCE","-540","Eurasian Precursor","Greek (Pythagorean / Platonic)","Origin Marker","Pythagorean Tetractys and Plato's Five Regular Solids – Mathematical Tree of Life and Greek Tattva System","Pythagoras (c. 570–495 BCE); Plato (428–348 BCE)","Samos / Croton / Athens","Pythagorean sources via Iamblichus; Plato 'Timaeus' 53c–56c; Parpola JNES 52/3 (1993) pp. 186–188 and Excursus 3 pp. 205–208","Pythagorean tetractys (1+2+3+4=10; triangular arrangement of 10 points) encodes the same mathematical structure as the Assyrian Tree's 10 divine-number positions. Pythagoras spent years in Babylon learning from the Magi (ancient testimony). Plato's Timaeus assigns five regular solids to the five elements: CUBE=Earth; ICOSAHEDRON=Water; TETRAHEDRON=Fire; OCTAHEDRON=Air; DODECAHEDRON=Aether — exactly parallel to Vedic Pancha Mahabhutas with their five tattva shapes (square; crescent; triangle; circle; bindu point). Parpola argues Pythagoreanism, Orphism, and Platonism all emerged simultaneously from Assyrian intellectual collapse (c. 612 BCE).","Tetractys (10 points = 10 nodes); Monad; five regular solids (cube/icosahedron/tetrahedron/octahedron/dodecahedron); five elements; Pythagorean sacred numbers = Mesopotamian divine numbers","Kundalini (Platonic five solids = Greek tattva-shape equivalent: cube=earth=muladhara; tetrahedron=fire=manipura etc. – Tier B; structural parallel to Vedic five tattvas is Tier A); Kabbalah (Sefer Yetzirah structures ten Sefirot as Pythagorean ten numbers); Vedic Mahabhutas (parallel five-element geometry); Stupa (same earth-to-aether hierarchy)","Parpola JNES 52/3 (1993) pp. 186–188; O'Meara 'Pythagoras Revived' (OUP 1989) p. 27; Cornford 'Plato's Cosmology' (1937) pp. 210–239; Burkert 'Lore and Science in Ancient Pythagoreanism' (1972)","B","Parpola identifies Pythagoreanism as post-Assyrian system; 10-point tetractys = 10-node Tree diagram is his mathematical proof; Platonic five solids = Greek codification of five-element geometry; structural parallel to Vedic tattvas is Tier A; causal link is Tier B–C"
"c. 2400–1900 BCE","-2400","Eurasian Precursor","Harappan / Indus Valley","Origin Marker","Harappan Sacred Fig Tree (Asvattha / Pipal) – Proto-Bodhi Tree and Inverted Cosmic Tree","Unknown Indus Valley civilization","Mohenjo-daro / Harappa / Dholavira (Indus Valley)","Harappan pottery and glyptic c. 2400 BCE; Parpola JNES 52/3 (1993) p. 162 n. 1 and p. 191 n. 109; Kepinski (1982)","Harappan sacred tree forms (attested in pottery, glyptic, Indus script since 2400 BCE) display Proto-Elamite and Akkadian influence; Parpola: 'basic doctrines of the Tree had already spread to India by the early third millennium BCE via Proto-Elamite intermediaries.' The Harappan sacred tree is the fig/pipal tree (asvattha / Ficus religiosa = Bodhi tree) = the same inverted tree of the Upanishads and Bhagavad Gita (roots above; branches below). This is NOT derived from the late Assyrian Tree but represents an earlier stage reaching India independently. Buddha's enlightenment under the pipal tree directly inherits this Harappan tradition.","Harappan fig tree / pipal (asvattha); Proto-Elamite influence; inverted cosmic tree (roots above; branches below); 2400 BCE attestation; Bodhi tree precursor; Bhagavad Gita inverted tree","Vedic/Kundalini (asvattha = Bodhi tree = Tree of Enlightenment; Buddha's enlightenment inherits Harappan sacred tree – Tier A); Mesopotamian Tree (shared 3rd-millennium Elamite intermediary per Parpola); Stupa (dome = cosmic egg = Harappan pipal dome association)","Parpola JNES 52/3 (1993) p. 162 n. 1; Mackay 'Further Excavations at Mohenjo-daro' (1938); Possehl 'The Indus Civilization: A Contemporary Perspective' (2002)","A","Harappan pipal/fig tree = one of the most common Harappan seal motifs (Tier A); identification as Vedic asvattha / Bodhi tree is Tier A; Proto-Elamite transmission vector is Tier B; possibly the oldest documented 'tree of enlightenment' motif"
"c. 1200–500 BCE","-1000","Eurasian Precursor","Scythian / Eurasian Steppe","Origin Marker","Scythian / Steppe World Tree – Eagle at Crown; Serpent at Root; Shamanic Cosmic Axis","Scythian; Saka; and related steppe cultures","Pontic Steppe / Central Asia (Ukraine through Kazakhstan to Altai Mountains)","Scythian metalwork (Pazyryk; Kul Oba; Tolstaya Mogila); Rolle 'The World of the Scythians' (1989); Anthony 'The Horse the Wheel and Language' (2007)","Steppe world tree attested across Eurasia from Black Sea to Mongolia: tree with eagle at crown; serpent/dragon at root; antithetical flanking animals (stags; horses; griffins); tree as cosmic axis connecting shamanic upper/middle/lower worlds; shaman ascends the world tree in trance; eagle = upper-world divine messenger; serpent = chthonic power. In Saka/Scythian art the eagle-serpent battle is one of the defining iconographic themes — directly parallel to Garuda-Naga in Indian tradition. Structurally identical to Mesopotamian sacred tree and Zoroastrian Gaokerena.","World tree; eagle at crown; serpent/dragon at root; flanking animals; shamanic three-world ascent; axis mundi; eagle-serpent battle; pan-Eurasian PIE substrate","Mesopotamian Tree (direct iconographic parallel; Scythians in contact with Assyria from 8th c. BCE – Tier B); Hekhalot (shamanic ascent through levels = Merkabah mysticism same structure); Kundalini (eagle-crown = sahasrara; serpent-root = muladhara kundalini – Tier C); Zoroastrian (Saena/Simurgh in Gaokerena = same eagle-in-tree); Norse Yggdrasil (identical eagle/serpent structure confirming PIE substrate)","Rolle 'The World of the Scythians' (University of California Press 1989); Anthony 'The Horse the Wheel and Language' (2007); Eliade 'Shamanism: Archaic Techniques of Ecstasy' (1964) ch. 8","A","Steppe world tree is pan-Eurasian and predates most textual traditions; eagle-crown / serpent-root polarity is the defining pan-Eurasian world-tree structure; confirms Proto-Indo-European substrate for the motif"
"c. 1000–1220 CE","1100","Eurasian Precursor","Norse / Germanic","Comparative Entry","Yggdrasil – Norse Cosmic Tree; Odin's Nine-Night Self-Sacrifice; Nine Worlds","Norse tradition; codified in Prose Edda (Snorri Sturluson c. 1220 CE)","Iceland / Scandinavia","Prose Edda (Gylfaginning ch. 15–16); Poetic Edda (Völuspá); Davidson 'Gods and Myths of Northern Europe' (1964)","Yggdrasil (Odin's gallows-tree / 'steed of the Terrible One') = cosmic ash connecting nine worlds; three roots reach to: Asgard (Urðarbrunnr well of fate); Jotunheim (Mimir's well of wisdom); Niflheim (Hvergelmir spring with dragon Niðhöggr gnawing the root). Eagle at crown; Niðhöggr at root; squirrel Ratatoskr carries messages up and down. Odin hangs for nine nights to gain the runes (esoteric knowledge through voluntary ordeal on the world-axis). Mimir's well of wisdom at the root = Ea's Apsu as wisdom-ocean (Mesopotamian structural parallel per Parpola).","Nine worlds; three roots; eagle at crown; Niðhöggr serpent at root; Odin nine-night ordeal; runes as gained esoteric knowledge; Mimir's well of wisdom","Steppe World Tree (structurally identical eagle/serpent polarity – PIE shared substrate); Mesopotamian Tree (Mimir's well = Ea's Apsu wisdom-ocean; Odin hanging = king-as-Tree mystical ordeal); Kundalini (Odin's nine-night ordeal on tree = tapas/kundalini activation through sustained suffering – Tier C); Hekhalot (runes as passwords obtained through divine ordeal – Tier C)","Davidson 'Gods and Myths of Northern Europe' (Penguin 1964); Simek 'Dictionary of Northern Mythology' (1993); Turville-Petre 'Myth and Religion of the North' (1964)","B","Yggdrasil is the most complete world-tree system in European tradition; eagle-serpent polarity confirms pan-Eurasian PIE pattern; Odin hanging = world-axis self-sacrifice shares theology with crucified Christ and Osiris-in-tree"
"c. 300 BCE–200 CE","-200","Eurasian Precursor","Daoist / Chinese","Origin Marker","Daoist Microcosmic Orbit (Xiao Zhoutian) – Chinese Kundalini Equivalent","Daoist inner alchemy (neidan) tradition; Yellow Emperor tradition","China (Han Dynasty and onward)","Huang Di Nei Jing (c. 300–100 BCE); 'The Secret of the Golden Flower' (Taiyi Jinhua Zongzhi); Ge Hong 'Baopuzi' (c. 320 CE); Cleary tr. (1991)","Microcosmic orbit (small heavenly circulation = Xiao Zhoutian): qi circulates through two primary channels: (1) Du Mai (Governing Vessel) = ascending along spine from tailbone (Huiyin) to crown (Baihui) = structurally equivalent to sushumna/kundalini rising; (2) Ren Mai (Conception Vessel) = descending from crown down front to perineum = completing the circuit. Three dan tian (cinnabar fields) as energy centers: lower dan tian (belly/navel) = muladhara equivalent; middle dan tian (heart) = anahata equivalent; upper dan tian (crown/third eye) = sahasrara equivalent. 'Return to the source' = union with Dao = kundalini reaching the crown.","Du Mai (spine-ascending = sushumna); Ren Mai (front-descending = circuit completion); three dan tian (lower/middle/upper = three chakra zones); qi circulation; inner alchemy; return to source","Kundalini (Du Mai = sushumna; three dan tian = lower-middle-upper chakra zones; microcosmic orbit = kundalini body-circuit – Tier A for structural parallel; independent development); Hekhalot (ascending channel to the divine = same vertical ascent motif); Stupa (three dan tian = three main stupa architectural levels)","Cleary 'The Secret of the Golden Flower' (1991); Despeux 'Taoisme et corps humain' (1994); Needham 'Science and Civilisation in China' vol. 5 pt. 5 (1983)","B","Du Mai/Ren Mai circuit = most structurally direct non-Indian parallel to kundalini; three dan tian = three-zone chakra system; independent development is Tier A; causal connection to Indian system is Tier C"
"c. 1200–600 BCE","-1001","Eurasian Precursor","Canaanite / Ugaritic","Origin Marker","Asherah – Sacred Tree / Serpent Goddess as Living Energy Axis in Israelite Religion","Asherah cult; Canaanite tradition; Israelite religion (before Deuteronomistic reform)","Canaan / Ugarit / Israel (Syro-Palestinian region)","Ugaritic texts KTU 1.1–6; 1 Kgs 14:23; 2 Kgs 17:10; Dt 16:21; Hadley 'The Cult of Asherah in Ancient Israel and Judah' (Cambridge UP 2000)","Asherah = Canaanite mother goddess symbolized by a wooden pole or stylized tree (asherah); often depicted as a nude figure with snakes and flanking animals; the asherah pole stood beside Yahweh's altar in the Jerusalem Temple until the 7th c. BCE Deuteronomistic reform; Lady of the Sea; mother of 70 gods; her tree = axis connecting heaven and earth. Her serpent association links her to Egyptian Wadjet and Babylonian Ishtar/Tiamat = she IS the Sefirah Tiferet/Ishtar on Parpola's Mesopotamian Tree diagram. Her suppression by Deuteronomistic reformers = the erasure of the sacred tree / feminine from Israelite religion that Hekhalot mysticism arguably seeks to recover through the Shekhinah.","Asherah pole (sacred tree); nude goddess; flanking animals; serpent association; Lady of the Sea; mother of 70 gods; prohibited in Deuteronomistic reform; Shekhinah as continuation","OT Visions (Asherah's suppression is the backdrop to Hekhalot's recovery of Shekhinah as feminine divine presence – Tier B); Mesopotamian Tree (Asherah = Canaanite form of Babylonian Ishtar = Tiferet on Parpola's diagram – Tier B); Kundalini (Asherah as Shakti goddess = divine feminine energy axis – Tier C)","Hadley 'The Cult of Asherah in Ancient Israel and Judah' (Cambridge UP 2000); Smith 'The Early History of God' 2nd ed. (2002) ch. 4; Dever 'Did God Have a Wife?' (2005)","A","Asherah pole = one of the best-documented sacred objects in biblical archaeology (Tier A); identification with Babylonian Ishtar/Tiferet on Parpola's Tree is Tier B; the Asherah→Shekhinah continuity in Jewish mysticism is a major scholarly discussion (Tier B)"
"c. 150 BCE–400 CE","-50","Eurasian Precursor","Gnostic / Mandaean","Origin Marker","Mandaean Lightworld Ascent – Seven Sky-Gates / Password-Guarded Heavens / Living Water Column","Mandaean tradition (Nasoreai priests; John the Baptist community)","Lower Mesopotamia / southern Iraq and Iran (Aramaic-speaking)","Ginza Rba (The Great Treasure; Lidzbarski ed. 1925); Mandaean Book of the Zodiac; Buckley 'The Mandaeans: Ancient Texts and Modern People' (AOS 2002)","Mandaean system: soul ascends through seven planetary heavens (matharthas) back to the Lightworld (Alma d-Nhura); each heaven guarded by Uthra (angelic beings) requiring passwords; soul must demonstrate purity; the Lightworld = source of living water and divine light; John the Baptist revered as prophet; baptism (masbuta) in flowing water = repeated ritual of ascent/purification; the light-column (stauros = pillar of light) = axis of return. Structurally the closest geographic and theological parallel to Hekhalot outside Jewish tradition — both are Mesopotamian-area systems with seven-heaven/seven-hall angelic gatekeeping and password requirements.","Seven planetary heavens; password-guarded angelic gates; Uthra; Lightworld; living water; light-pillar (stauros); John the Baptist; baptism as repeated ascent","Hekhalot (seven heavens with angelic gatekeepers requiring passwords = structural twin of seven Hekhalot halls – Tier A parallel); OT Visions (John the Baptist tradition; NT heavenly visions); Kundalini (light-pillar/stauros = subtle body central channel – Tier C)","Buckley 'The Mandaeans: Ancient Texts and Modern People' (AOS 2002); Drower 'The Mandaeans of Iraq and Iran' (1937); Scholem 'Jewish Gnosticism, Merkabah Mysticism' (1960) pp. 44–56","A","Mandaean system is the closest geographic and structural parallel to Hekhalot outside Jewish tradition; direct Hekhalot influence OR common Babylonian source both plausible; the password-guarding structure is strikingly specific and unlikely to be coincidental"
"c. 200 BCE–400 CE","-100","Eurasian Precursor","Greco-Egyptian (Hermetic)","Origin Marker","Caduceus – Hermetic Serpent-Staff as Western Kundalini Diagram (Ida / Pingala / Sushumna)","Hermes Trismegistus (revealed tradition); Greek-Egyptian synthesis","Alexandria / Egypt (Greco-Roman period)","Corpus Hermeticum (Nock & Festugière ed. 1945); Homeric Hymn to Hermes; healing-serpent-staff-and-pillar.csv; Parpola JNES 52/3 (1993) n. 68","The caduceus (kerykeion) = Hermes's staff with two intertwined serpents topped by wings; the two serpents = polar opposites (ida/pingala; active/passive; sun/moon; mercy/judgment); the central staff = sushumna = Pillar of Equilibrium on the Kabbalistic Tree; the wings at top = sahasrara / crown / Keter; the intertwining creates the exact ida-pingala pattern of kundalini physiology. The caduceus appears as a healing and psychopomp symbol — guide of souls = same function as the angelus interpres in Hekhalot (angelic guide at each hall). In Parpola's diagram Hermes = Nabu/Mercury = Netzah (Victory/Messenger) on the divine tree; apkallu figures holding pine cones = same position on the Assyrian Tree.","Two intertwined serpents (ida/pingala); central staff (sushumna); wings at top (sahasrara/Keter); psychopomp function; healing; polar opposites unified on central axis; Nabu-Hermes = Netzah","Kundalini (caduceus = Western kundalini diagram: two serpents = ida/pingala; staff = sushumna; wings = sahasrara – Tier B; structural parallel widely accepted in comparative mysticism); Hekhalot (Metatron/Hermes as angelic guide-of-souls parallel); Mesopotamian Tree (apkallu with pine cone = Nabu-Hermes position on Parpola's Tree); OT Visions (Moses' brazen serpent Nehushtan = staff-with-serpent precursor)","Kingsley 'Ancient Philosophy Mystery and Magic: Empedocles and Pythagorean Tradition' (OUP 1995); healing-serpent-staff-and-pillar.csv; Parpola JNES 52/3 (1993) n. 68","B","Caduceus-as-kundalini is the standard comparative mysticism argument (Tier B); structural parallel visually undeniable; functional psychopomp-angelus interpres parallel strengthens the case; causal connection between Greek and Indian systems unproven"
