Date_Label,Date_Sort,Tradition_System,Sub_Tradition,Entry_Type,Title_Event,Person_Visionary,Location,Source_Text,Description,Key_Motifs,Parallel_Systems,Scholarly_Source,Evidence_Tier,Notes
"c. 50–56 CE",51,NT Vision,Pauline Epistles,Vision Episode,Paul Caught Up to Third Heaven / Paradise – Inexpressible Revelations,"Paul ('a man in Christ' – self-referential)",Asia / Corinth,2 Corinthians 12:2–4,"Paul describes being 'caught up' (harpazō) to the third heaven; then caught up to paradise; heard arreta rhemata (inexpressible / unutterable words) not lawful to tell; bodily ambiguity: 'whether in body or out of body I do not know'","Ascent (harpazō); third heaven / paradise; inexpressible secret words; bodily ambiguity; fourteen years prior (c. 38 CE)","Hekhalot (ascent through heavenly halls ending in divine presence; forbidden / secret words = passwords and hymns in Hekhalot; bodily ambiguity in Merkabah ascent); 2 Enoch (seven-heaven ascent); OT Visions (Ezekiel transport; Isaiah throne); NT (Acts 22 commissioning vision)","Segal, 'Paul the Convert' (1990) pp. 34–71; Himmelfarb, 'Ascent to Heaven in Jewish and Christian Apocalypses' (1993) pp. 96–114; Rowland, 'The Open Heaven' (1982) pp. 376–386",A,"Himmelfarb and Segal both argue this IS a Jewish Merkabah-type ascent; 'inexpressible words' parallel to Hekhalot secrecy; most direct NT parallel to Hekhalot practice"
"c. 95 CE",95,NT Vision,Johannine Apocalyptic,Vision Episode,Revelation – John's Heavenly Throne Vision and Subsequent Visions,John of Patmos,Patmos Island (Aegean),"Revelation 1:9–22:21; esp. 1:12–20; 4:1–11; 5:1–14; 6–22","Series of apocalyptic visions: seven lampstands; Son of Man with white hair and eyes of fire; throne room vision (Rev 4) with enthroned figure like jasper and carnelian; rainbow; 24 elders with golden crowns; four living creatures (tetramorpha: lion-ox-human-eagle) with many eyes and wings saying 'Holy Holy Holy'; sea of glass; Lamb with seven eyes; opening of seven seals; trumpets; bowls","Open door in heaven; throne room; four living creatures; rainbow; sea of glass; 24 elders; trishagion; Lamb; scroll; seven seals; New Jerusalem","Hekhalot (throne room exactly parallels Hekhalot Rabbati 7th hall: four creatures = hayyot; 24 elders = angelic court; trishagion from Isaiah 6 appears in both); OT Visions (Ezekiel 1; Daniel 7; Isaiah 6 all synthesized in Revelation 4); Merkabah (kavod-throne imagery)","Rowland, 'The Open Heaven' (1982) – entire book; Collins, 'The Apocalyptic Imagination' (1998) ch. 8; Himmelfarb, 'Ascent to Heaven' (1993) pp. 102–118",A,"Revelation 4–7 is the NT functional equivalent of Hekhalot Rabbati's throne room; Rowland's 'open heaven' is the definitive study linking Revelation to Merkabah tradition"
"c. 200–400 CE",250,Hekhalot/Merkabah,Hekhalot Literature,Text,Hekhalot Zutarti (Lesser Palaces) – Ascent Technique and Passwords,"Rabbi Akiva (protagonist)",Palestine / Babylonia,Hekhalot Zutarti (Schäfer Synopse §335–426),"Fragmentary Hekhalot text focused on ascent methodology; mystical hymns; passwords (seals and names); visionary descriptions of the divine chariot and angelic beings; instructions for approach to the throne; dangers noted; earliest stratum of systematic Hekhalot practice","Ascent technique; passwords/seals; angelic beings; chariot vision; hymns; danger","OT Visions (Ezekiel 1 as explicit foundation); NT Visions (Paul's ascent – 2 Cor 12); Kundalini (systematic technique for inner ascent – structural Tier C parallel)","Schäfer, 'The Hidden and Manifest God' (1992); Halperin, 'The Faces of the Chariot' (1988) pp. 359–381; Davila, 'Descenders to the Chariot' (2001)",A,"Earliest fully developed Hekhalot text stratum; dates uncertain (200–500 CE range); 'descenders to the chariot' = practitioners of this tradition"
"c. 300–500 CE",400,Hekhalot/Merkabah,Hekhalot Literature,Text,Hekhalot Rabbati (Greater Palaces) – Seven Halls with Guardians,"Rabbi Ishmael; Rabbi Akiva; Rabbi Nehunya ben HaKanah",Palestine / Babylonia,"Hekhalot Rabbati (Schäfer Synopse §81–306)","Major Hekhalot text: seven heavenly halls (hekhalot); each guarded by increasingly formidable angelic gatekeepers requiring passwords and ritual seals; mystical hymns and prayers; dangers for the unworthy (marble vision test); culminates in vision of the Divine Throne (Kisse HaKavod) and Shekhinah; text includes 'Sar Torah' (Prince of Torah) tradition for gaining supernatural knowledge","Seven halls; angelic guardians; passwords; mystic hymns; purification; marble vision test; divine throne; Shekhinah; Sar Torah","OT Visions (Isaiah 6 throne; Ezekiel 1 chariot; Zechariah 6 four chariots); NT Visions (Revelation 4 throne room – structural twin); Kundalini (seven halls parallel seven chakras structurally – Tier C)","Schäfer, 'The Hidden and Manifest God: Some Major Themes in Early Jewish Mysticism' (1992); Elior, 'The Three Temples: On the Emergence of Jewish Mysticism' (2004); Scholem, 'Major Trends in Jewish Mysticism' (1941) ch. 2",A,"Core Hekhalot text; most studied in the tradition; seven-hall schema is the structural basis for the Kundalini parallel (seven chakras) though no genealogical link established"
"c. 500–600 CE",540,Hekhalot/Merkabah,Hekhalot Literature,Text,3 Enoch / Sefer Hekhalot – Enoch's Transformation into Metatron,"Rabbi Ishmael (narrator); Enoch / Metatron (protagonist)",Babylonia,3 Enoch / Sefer Hekhalot (Schäfer Synopse §1–80; Alexander tr. in Charlesworth OTP vol. 1),"Rabbi Ishmael ascends and meets Metatron; told Enoch's story: ascent through 7 heavens; transformation of Enoch's body into fire; crowned with crown like YHWH's; 70 names of Metatron given; enthroned as 'Lesser YHWH' (YHWH HaQatan); vast angelic hierarchies described; cosmic secrets of creation","Enoch's transformation; body into fire; Metatron; enthronement; 'Lesser YHWH'; 70 names; angelic hierarchy; cosmic secrets; crown; robe","OT Visions (Genesis 5:24 'Enoch walked with God and was no more'; 1 Enoch 14; 2 Enoch); Hekhalot Rabbati (same hall system); NT Visions (Transfiguration transformation motif; Paul's commissioning); Kundalini (body transformed into light/fire = kundalini awakening completion – Tier C)","Odeberg, '3 Enoch or the Hebrew Book of Enoch' (1928); Alexander, '3 Enoch' in Charlesworth OTP vol. 1 (1983); Orlov, 'The Enoch-Metatron Tradition: The Date of Composition of 2 Enoch' (2005)",A,"Metatron as 'divinized human' is central to both Hekhalot and later Kabbalah; human → angel → divine figure transformation"
"c. 300–700 CE",550,Hekhalot/Merkabah,Hekhalot Literature,Text,Ma'aseh Merkavah (Work of the Chariot) – Hymnic Ascent Technology,"Rabbi Akiva; Rabbi Ishmael",Palestine / Babylonia,Ma'aseh Merkavah (Schäfer Synopse §544–596),"Collection of mystical hymns and prayers for Merkabah ascent; liturgical dimension foregrounded; hymns to angelic hosts at each stage; divine name invocations; adjuration of angelic gate-keepers; passwords; ritual gestures; the chariot vision as goal; transformation through sustained hymnic practice","Mystical hymns; angelic adjuration; divine names; passwords; chariot vision; transformation through song","OT Visions (Ezekiel 1 chariot as explicit referent); Hekhalot Rabbati (companion text; different emphasis); Kundalini (mantra/hymn as activating technology – Tier B structural parallel: both use sonic vibration to navigate to divine)","Schäfer, 'The Hidden and Manifest God' (1992); Davila, 'Descenders to the Chariot: The People behind the Hekhalot Literature' (2001)",A,"Liturgical / practical dimension of Hekhalot; hymns function as 'technology' closely parallel to mantra in Tantric kundalini yoga"
"c. 300–200 BCE",-250,Kundalini/Subtle Body,Classical Yoga,Text,Yoga Sutras of Patanjali – Systematic Yoga Framework,Patanjali,Northern India (location uncertain),Yoga Sutras of Patanjali (c. 300–100 BCE; Bryant ed. 2009),"Codification of eight-limbed yoga (ashtanga): yama-niyama-asana-pranayama-pratyahara-dharana-dhyana-samadhi; pratyahara (withdrawal of senses from objects) as direct precursor to Hekhalot-style withdrawal; samadhi and siddhis (supernormal powers); prana and kundalini implicit in pranayama descriptions","Eight limbs; pratyahara; samadhi; siddhis; prana; internal focus","Hekhalot (withdrawal and preparation before heavenly ascent; powers gained through practice; restricted transmission); OT Visions (prophetic preparation and concentration)","Feuerstein, 'The Yoga Tradition' (1998); Bryant, 'The Yoga Sutras of Patanjali: A New Edition, Translation, and Commentary' (2009)",A,"Kundalini not yet named by that term; systematic framework that all later kundalini traditions build on"
"c. 450–650 CE",550,Kundalini/Subtle Body,Early Shaiva Tantra,Origin Marker,Early Shaiva Agamas – Emergence of Kundalini as Technical Term,Unknown Shaiva masters,Kashmir / South India,"Early Shaiva Āgamas (c. 450–650 CE; primary source: Sanderson 1988)","First systematic Shaiva Tantric texts; non-dualistic metaphysics; yogic practices with explicit kundalini terminology beginning to appear; shakti (divine energy) as cosmic power; body as microcosm of cosmos; initiation-based restricted transmission","Kundalini (emerging); shakti; body-as-cosmos; initiation; divine energy; non-dualism","Hekhalot (initiation-based restricted knowledge; both systems dangerous without proper initiation); NT Visions (transformative divine encounter requiring preparation)","Sanderson, 'Saivism and the Tantric Traditions' in Sutherland et al., 'The World's Religions' (1988); White, 'The Alchemical Body' (1996)",A,"Sanderson's reconstruction; explicit kundalini vocabulary emerges in this period in Shaiva texts"
"c. 700–800 CE",725,Kundalini/Subtle Body,Kashmir Shaivism,Text,Vijñana Bhairava Tantra – 112 Kundalini Dharanas,"Bhairava / Shiva (revealed); Bhairavi (questioner)",Kashmir,"Vijñana Bhairava Tantra (c. 7th–8th c. CE; Singh tr. 1979)","112 centering techniques (dharanas) for direct experience of Bhairava-consciousness (Shiva); includes breath at turning points; sense withdrawal; kundalini awakening practices; mantra; visualization of empty sky; paradoxical methods; attention to liminal states (entering sleep; sneezing; sexual union); most complete early kundalini / contemplation manual","112 dharanas; kundalini; breath at turning-points; sense withdrawal; void; inner fire; paradoxical methods; liminal states","Hekhalot (systematic preparation and 'keys' for divine encounter; both use specific techniques as passports to divine – structural Tier B parallel); Meditation Timeline (Plotinus on the One; Desert Fathers' hesychia); NT Visions (threshold / liminal quality of vision states)","Singh, 'Vijñāna Bhairava or Divine Consciousness' (1979); Dyczkowski, 'The Doctrine of Vibration' (1987); Muller-Ortega, 'The Triadic Heart of Siva' (1989)",A,"Core Kashmir Shaivism text; kundalini explicitly central; 112 techniques form a complete contemplative system"
"c. 820–875 CE",850,Kundalini/Subtle Body,Kashmir Shaivism,Text,Spanda Karikas – Kundalini as Divine Vibration (Spanda),"Vasugupta (attr.); Kallata (commentary)",Kashmir,"Spanda Karikas (c. 825–875 CE); Spanda Sandoha; Spanda Nirnaya","Teaching of divine vibration (spanda) as the pulse of Shiva-consciousness underlying all experience; kundalini as vibrational energy; observing spanda in liminal states (waking/sleeping transition; strong emotion; aesthetic rapture); recognition (pratyabhijna) of one's own divine nature as the goal","Spanda (divine vibration); kundalini as pulsation; liminal states; recognition; aesthetic rapture; non-dual consciousness","Hekhalot (liturgical hymns as vibrational approach to divine; angels' hymns as spanda of higher realms – Tier B); Meditation Timeline (Plotinus; Pseudo-Dionysius); Nonduality (Advaita; Dzogchen parallel)","Dyczkowski, 'The Doctrine of Vibration' (1987); Dyczkowski, 'The Stanzas on Vibration: The Spandakārikā with Four Commentaries' (1992)",A,"Unique vibrational ontology; kundalini as the pulsation of divine consciousness rather than anatomical energy"
"c. 850–1016 CE",950,Kundalini/Subtle Body,Kashmir Shaivism,Text / School,Trika Shaivism – Abhinavagupta's Synthesis; Full Chakra-Kundalini System,"Vasugupta; Abhinavagupta (950–1016 CE); Kshemaraja",Kashmir,"Tantrāloka (Abhinavagupta); Shiva Sutras; Pratyabhijñā-hṛdayam","Systematic elaboration of kundalini as Shakti-energy rising through chakras; seven-chakra system articulated (muladhara to sahasrara); three main nadis (sushumna / ida / pingala); kundalini sleeping at base; awakened through initiation (shaktipata); rises through chakras; union of Shiva (crown) and Shakti (base) as non-dual consciousness; Abhinavagupta's Tantrāloka is encyclopedic synthesis","Kundalini Shakti; 7 chakras (muladhara → sahasrara); sushumna; ida; pingala; shaktipata (initiation); Shiva-Shakti union; non-dual consciousness","Hekhalot (seven-stage ascent from entry to divine throne = seven chakras from base to crown – strongest structural Tier C parallel; BOTH end in union with/vision of the divine; BOTH require initiation and a guide); NT Visions (transformative divine encounter); Nonduality (Advaita parallel)","Sanderson, 'Saivism and the Tantric Traditions' (1988); Muller-Ortega, 'The Triadic Heart of Siva' (1989); Dyczkowski, 'The Doctrine of Vibration' (1987); Flood, 'An Introduction to Hinduism' (1996)",A,"Abhinavagupta is THE central figure of Kashmir Shaivism; Tantrāloka synthesizes all Tantric traditions; seven-chakra kundalini system fully codified here"
"c. 1000–1400 CE",1200,Kundalini/Subtle Body,Natha Tradition / Hatha Yoga,Text / School,Natha Siddhas – Kundalini via Physical-Energetic Practices,"Matsyendranatha (c. 900–1000 CE); Gorakshanatha (c. 1000–1100 CE); subsequent Natha teachers",Northern India / Nepal,"Goraksha Shataka; Siddha Siddhanta Paddhati; Khecarividya; Gorakshanath biographical traditions","Systematic hatha yoga for kundalini awakening; physical postures (asanas) preparing the body; pranayama (breath control) to direct prana into sushumna; bandhas (locks: mula-uddiyana-jalandhara) to raise kundalini; khechari mudra (tongue practice) to access amrita; inner alchemy; bodily transformation","Hatha yoga; kundalini; pranayama; bandha; mudra; khechari; inner alchemy; body as vehicle for liberation","Kundalini (direct elaboration of Kashmir Shaivism framework); Tantric traditions (Kaula lineage descent); Meditation Timeline (hatha yoga as contemplative practice)","Mallinson, 'The Khecarīvidyā of Ādinātha' (2007); Mallinson & Singleton, 'Roots of Yoga' (2017); White, 'The Alchemical Body: Siddha Traditions in Medieval India' (1996)",A,"Matsyendranatha linked to origins of Kaula tantra; Gorakshanatha codifies hatha-kundalini as a practice lineage"
"c. 1400–1500 CE",1450,Kundalini/Subtle Body,Hatha Yoga,Text,Hatha Yoga Pradipika – Classical Kundalini Manual,Svātmārāma,Northern India (Gorakhnath lineage),Hatha Yoga Pradipika (c. 1450 CE; Mallinson tr. 2004),"Most influential classical text on hatha yoga and kundalini; four chapters: asana (15 poses); pranayama (8 kumbhakas); mudra/bandha (10 including maha mudra and khechari); samadhi; systematic treatment of kundalini rising through sushumna; stages of samadhi; nada (inner sound) as guide for ascending kundalini","Kundalini Shakti; sushumna; ida; pingala; muladhara to brahmarandhra; chakras; mudra / bandha; nada (inner sound); samadhi stages","Hekhalot (seven-level systematic ascent; restricted / initiated practice; inner sound/music as Hekhalot hymns parallel – Tier B); Yoga Sutras (Patanjali framework applied); Meditation Timeline (hatha yoga entry c. 1450)","Mallinson, 'The Hatha Yoga Pradīpikā of Svātmārāma' (2004); Birch in 'Yoga in Practice' (2011)",A,"Standard reference text for kundalini system in physical yoga; bridges Natha tradition to modern yoga"
"c. 1200–1300 CE",1250,Hekhalot/Merkabah,Medieval Kabbalah,Text,Sefer HaZohar (Book of Splendor) – Kabbalistic Hekhalot Synthesis,"Moses de León (actual author per most scholars); attributed to Rabbi Shimon bar Yochai (2nd c. CE)",Castile (Spain),"Zohar (published c. 1280–1286 CE; Pritzker Edition tr. Matt 2004–2017 12 vols.)","Foundational medieval Kabbalistic text; extensive palaces (hekhalot) described; Idra Rabba and Idra Zuta sections; soul's ascent through sefirot; four worlds (Assiyah-Yetzirah-Beriah-Atzilut); Shekhinah as divine presence; mystical marriage symbolism; roots in Hekhalot but transformed by Neoplatonic Aristotelian framework","Sefirot; four worlds; Shekhinah; divine emanations; mystical marriage; soul's journey; hekhalot palaces; divine union","Hekhalot (Zohar extensively cites and transforms Hekhalot; Idra sections = elaborated throne room; seven lower sefirot parallel seven halls – Tier A-B); Kundalini (ten sefirot as kundalini chakras – structural Tier C); OT Visions (Torah as esoteric vision text)","Scholem, 'Major Trends in Jewish Mysticism' (1941) ch. 5–6; Matt, 'The Zohar: Pritzker Edition' (2004–2017); Idel, 'Kabbalah: New Perspectives' (1988)",A,"Zohar synthesizes all prior Jewish mystical traditions; sefirot-as-chakras structural parallel is cited in comparative mysticism literature (Tier C)"
"c. 600 CE",630,Hekhalot/Merkabah,Islamic Parallel,Comparative Entry,Muhammad's Night Journey (Isra / Mi'raj) – Seven-Heaven Ascent,Muhammad,Mecca → Jerusalem → Seven Heavens,"Quran 17:1; Hadith: Bukhari Sahih 5:58:227; Muslim 1:309; Ibn Hisham Sira; Mi'raj literature","Muhammad's night journey (isra) on Buraq from Mecca to Jerusalem; ascent (mi'raj) through seven heavens; encounters Adama in first; Jesus and John in second; Joseph in third; Idris (Enoch) in fourth; Aaron in fifth; Moses in sixth (weeps at Muhammad's greater community); Abraham in seventh at Sidrat al-Muntaha (Lote Tree); receives 50 (reduced to 5) daily prayers; parallels to Hekhalot seven-heaven schema widely noted","Night journey; Buraq (heavenly transport); seven heavens; prophet at each level; Lote Tree boundary; divine encounter; prayer commandments","Hekhalot (seven heavens with distinct inhabitants at each level = Hekhalot seven halls; encountering figures at each gate); OT Visions (Ezekiel transport vision; Isaiah throne); NT Visions (Paul's third heaven; Revelation); 2 Enoch (seven heavens with inhabitants)","Colby, 'Narrating Muhammad's Night Journey: Tracing the Development of the Ibn Abbas Ascension Discourse' (2008); Sells, 'Early Islamic Mysticism' (1996); Elior, 'Jewish Mysticism' (2006)",B,"Structural parallels strong; direct Hekhalot influence on Mi'raj literature is debated; convergent development from shared apocalyptic Jewish tradition is likely; Tier B"
"c. 950–1200 CE",1100,Hekhalot/Merkabah,Islamic Parallel,Comparative Entry,Sufi Mysticism – Mi'raj as Inner Ascent; Heavenly Palace Traditions,"Al-Hallaj (858–922 CE); Ibn Arabi (1165–1240 CE)","Baghdad; Andalusia; Damascus","Hallaj, 'Kitab al-Tawasin'; Ibn Arabi, 'Futuhat al-Makkiyya'; Sufi mi'raj literature","Sufi interiorization of Mi'raj as inner ascent of the soul; heavenly palace (qasr) traditions; al-Hallaj's 'I am the Truth' (Ana al-Haqq) as union with divine; Ibn Arabi's 'Unity of Being' (wahdat al-wujud); seven levels of the soul / nafs; inner light experiences","Inner ascent; soul's journey; divine union; seven levels of nafs; inner light; fana (annihilation)","Hekhalot (inner ascent to divine throne; divine union as goal; seven-level schema); Kundalini (seven chakras / seven nafs structural parallel – Tier C); OT Visions (foundation through Quranic / hadith mediation)","Sells, 'Mystical Languages of Unsaying' (1994); Chittick, 'The Sufi Path of Knowledge: Ibn Arabi's Metaphysics of Imagination' (1989)",B,"Hekhalot → Mi'raj → Sufi chain hypothesized; convergent development from shared Abrahamic mystical vocabulary; Tier B for direct influence"
"c. 200 BCE–100 CE",-100,Hekhalot/Merkabah,Apocalyptic Judaism,Text,Apocalypse of Abraham – Ascent; Chariot; Purification by Fire,Abraham (pseudonymous),Diaspora / Palestine,"Apocalypse of Abraham (Charlesworth OTP vol. 1 pp. 681–705; likely 1st–2nd c. CE)","Abraham purified by fire from angel Yaoel; ascent through levels of heaven; chariot throne vision; Yaoel as Metatron prototype; vision of the Fall; eschatological schema; fire as purification agent before vision","Fire purification; angelic guide (Yaoel); chariot-throne vision; ascent; cosmic secrets revealed to patriarch","Hekhalot (Yaoel/Metatron as angelic guide; fire purification before throne = coal in Isaiah 6; chariot throne); OT Visions (Abraham covenant vision Gen 15; Isaac binding Gen 22)","Rubinkiewicz, 'Apocalypse of Abraham' in Charlesworth OTP vol. 1 (1983); Rowland, 'The Open Heaven' (1982) pp. 86–89",B,"Yaoel = proto-Metatron is important Hekhalot connection; date and provenance uncertain"
"c. 300–200 BCE",-300,Kundalini/Subtle Body,Vedic / Yogic,Text,Upanishads – Katha and Mundaka – Sushumna and Inner Light,"Nachiketa (Katha); anonymous (Mundaka)",Northern India,"Katha Upanishad (c. 300 BCE); Mundaka Upanishad (c. 300 BCE)","Katha Upanishad introduces the concept of the sushumna channel 'through which the spirit rises' (Katha 6:16–17); Mundaka describes the 'path of the gods' (devayana) up through the central channel; brahman as inner light; the soul rising at death through central channel","Sushumna channel; inner light; soul's ascent through central channel; brahman as inner light; devayana (path of gods)","Kundalini (sushumna = the central channel of kundalini system; earliest named textual reference); Hekhalot (ascending through central passage to divine throne); OT Visions (Jacob's ladder = sushumna – Tier C structural)","Olivelle, 'The Early Upanishads' (1998); Feuerstein, 'The Yoga Tradition' (1998) pp. 229–235",A,"Katha Upanishad 6:16–17 is among the earliest explicit references to the central channel (sushumna) as path of ascent"
"c. 100 BCE–100 CE",-50,Hekhalot/Merkabah,Hellenistic Jewish,Text,Philo of Alexandria – Ecstatic Prophecy and 'Sober Intoxication' of the Soul,Philo of Alexandria,Alexandria (Egypt),"Philo, 'On the Migration of Abraham'; 'Who is the Heir?'; 'On the Special Laws'","Philo describes ecstatic states where the soul is 'taken up' and the divine spirit enters; 'sober intoxication' (nephalios methe) as mystical state; the divine logos as intermediary; contemplative ascent as goal of philosophy; precursor to Christian mysticism and indirect link to Hekhalot","Ecstatic ascent; divine spirit entering; sober intoxication; logos as intermediary; soul's flight","Hekhalot (ecstatic ascent; intermediary divine figure = Metatron parallel); NT Visions (Paul's Merkabah-type experience; 2 Cor 12); Meditation Timeline (Philo entry)","Wolfson, 'Philo: Foundations of Religious Philosophy in Judaism, Christianity and Islam' (1947); Segal, 'Paul the Convert' (1990) pp. 40–45",A,"Philo bridges Second Temple Judaism and Hekhalot mysticism; 'sober intoxication' parallels both kundalini and Paul's visionary state"
"c. 800–600 BCE",-740,OT Vision,Pre-Exilic Prophetic,Vision Episode,Isaiah 6 Extended: Purification-Then-Commission Pattern as Hekhalot Prototype,"Isaiah ben Amoz",Jerusalem Temple,Isaiah 6:1–13 (see also full Isaiah vision tradition),"The sequential pattern of Isaiah 6: (1) vision of divine throne → (2) terror and unworthiness ('woe is me') → (3) purification by live coal to lips → (4) commission and sending; this exact sequence becomes the structural template for Hekhalot ascent: (1) approach throne → (2) tests and danger → (3) purification/password → (4) entry and revelation","Sequential pattern: vision → unworthiness → purification → commission","Hekhalot (sequential ascent through six halls → purification test → 7th hall entry = Isaiah's exact sequence mapped onto seven halls); Kundalini (chakra-by-chakra purification as parallel process – Tier C)","Scholem, 'Jewish Gnosticism, Merkabah Mysticism, and Talmudic Tradition' (1960) pp. 20–37; Elior, 'The Three Temples' (2004) pp. 4–17",A,"Isaiah 6 is arguably THE structural template for Hekhalot ascent; Scholem and Elior both emphasize this dependency"
"c. 100 CE",95,Hekhalot/Merkabah,Jewish-Christian Parallel,Comparative Entry,Revelation's Marble Vision Test Parallel – Hekhalot Rabbati Warning,John of Patmos (Revelation) / Hekhalot text,Patmos / Babylonia,"Hekhalot Rabbati §259 (Schäfer); Revelation 4:6 (sea of glass like crystal)","In Hekhalot Rabbati the mystic approaching the 6th hall is warned by the gatekeeping angel not to confuse the shining marble slabs for water; those who do call out 'Water! Water!' and are destroyed; this same 'sea of glass' appears in Revelation 4:6; the Talmud also records the marble/water test warning","Shining marble / sea of glass; danger of confusion; water/crystal test; 6th hall","Hekhalot (central danger test in 6th hall); NT Visions (Revelation 4:6 sea of glass – identical image); OT Visions (Ezekiel 1:22 crystal firmament above)","Scholem, 'Jewish Gnosticism' (1960) pp. 14–19; Rowland, 'The Open Heaven' (1982) pp. 222–226; Halperin, 'The Faces of the Chariot' (1988) pp. 225–230",A,"This specific parallel – the marble/water/glass test – is the tightest textual link between Hekhalot Rabbati and Revelation 4"
