Topic,Details,,,,
c. 510-490 BCE,Introduction of Zoroastrian burial practices in Taxila,Exposure of the dead to vultures (sky burial) becomes evident in archaeological findings.,"Cultural Influence, Archaeological Evidence","Archaeological evidence suggests the adoption of Zoroastrian funerary customs in regions with emerging Buddhist presence, indicating cultural exchange.",Archaeological excavations in Taxila.
c. 563-483 BCE,Traditional life of Siddhārtha Gautama (Buddha),"The Buddha's teachings become the original source of the dharma concept, encompassing ethics, cosmology, and the path to liberation.","Foundational Event, Conceptual Development",Marks the emergence of Buddhism in a geographical and cultural context influenced by Persia and the broader Śramaṇa movement in India.,Buddhist canonical texts.
c. 500-400 BCE,Development of early Buddhist doctrine,"The Buddha's teachings explicitly reject core Zoroastrian concepts such as a singular creator god (Ahura Mazda), the notion of an eternal, unchanging soul, and a strict dualism of absolute good and evil.","Religious Response, Conceptual Contrast","Buddhism develops, in part, by offering alternative perspectives to the prevailing Zoroastrian ideas in the region.",Early Buddhist Suttas.
c. 500-400 BCE,"Use of epithet Śākamuni (""Sage of the Scythians"")","The Buddha is referred to by an epithet linking him to the Śaka people, a Central Eurasian group with connections to the Iranian plateau.","Linguistic/Cultural Link, Potential Historical Connection",Suggests potential Central Eurasian cultural connections or origins associated with the Buddha's lineage or early followers.,Buddhist texts and scholarly interpretations.
c. 500-400 BCE,Development of Śramaṇa tradition,"The rise of various ascetic and philosophical movements in India, including early Buddhism, Jainism, and Ajivika, distinct from Brahmanical and Zoroastrian traditions.","Religious Context, Conceptual Distinction","Early Buddhism emerges as part of a broader intellectual ferment in India, characterized by a rejection of established Vedic and potentially Zoroastrian norms.","Early Buddhist and Jain texts, historical accounts."
c. 500-400 BCE,Development of anātman (no-self) concept,"A core Buddhist doctrine asserting the impermanent and composite nature of the individual, directly contrasting with the Zoroastrian belief in an eternal, individual soul.","Conceptual Contrast, Philosophical Divergence",Highlights a fundamental philosophical difference between Buddhism and Zoroastrianism regarding the nature of the self.,Early Buddhist Suttas.
c. 500-400 BCE,Development of tetralemma logic (catuskoṭi),"A four-fold logical structure (A, not A, both A and not A, neither A nor not A) used to analyze philosophical propositions, contrasting with the dualistic framework often associated with Zoroastrianism.","Conceptual Contrast, Philosophical Divergence",Demonstrates a distinct Buddhist approach to philosophical inquiry that moves beyond simple binary oppositions.,Early Buddhist philosophical texts.
c. 480-390 BCE (Traditional),Life of Lao Tan (Laozi),"The reconstructed Old Chinese pronunciation of 老子 is *C.r̥ˤawʔ-tsəʔ, while some scholars have noted a potential phonetic similarity between the clan name Li (李) and possible pronunciations related to ""Gotama/Gautama.""",Linguistic Link (Speculative),"Suggests a highly speculative, though intriguing, possibility of a distant linguistic connection related to the Buddha's clan name.",Linguistic studies of Old Chinese and Sanskrit.
c. 450-350 BCE,Composition of core Tao Te Ching material,"The central concept of Tao (道/daʁwa~daʁma) exhibits a phonetic similarity to the Sanskrit word dharma (धर्म). While meanings differ significantly, the sound correspondence is notable.",Linguistic Link,"Presents a potential instance of linguistic resonance between a foundational concept in Taoism and a central term in Buddhism, though the direction of influence is debated.",Textual analysis of the Tao Te Ching and Sanskrit Buddhist texts.
c. 399-295 BCE,Life of Zhuangzi,The Zhuangzi text incorporates ideas that some scholars have interpreted as having parallels to the Buddhist concept of anātman (no-self) and the illusory nature of the ego.,Conceptual Parallel (Debated),"Suggests a possible independent development of similar philosophical ideas or potential early influence, though the direction and extent are debated.",Textual analysis of the Zhuangzi and early Buddhist texts.
c. 350-250 BCE,"""Hundred Schools of Thought"" period in China","A period of significant intellectual openness and philosophical innovation during the Warring States period, creating a fertile environment for the later adoption of foreign ideas.",Historical Context,Establishes a Chinese intellectual climate that was receptive to new philosophies and religious traditions from outside its borders.,Historical accounts of the Warring States period.
c. 330-325 BCE,Alexander's campaign reaches Northwest India,"Greek historical accounts mention encounters with ""Samanaioi,"" a Greek transliteration of the Indian term śramaṇa.","Historical Contact, Linguistic Evidence","Provides independent Greek verification of the existence and recognition of the śramaṇa tradition in India during this period, which included early Buddhists.",Greek historical accounts of Alexander's campaigns.
c. 323-185 BCE,Mauryan Empire in India,"The Mauryan rulers adopted titles like Devānāṃpriya (""Beloved of the Gods"") and Priyadarśi (""He who glances amiably""), reflecting a syncretic religious landscape.","Religious Context, Political Influence",Establishes a powerful imperial framework in India that would later significantly support and facilitate the spread of Buddhism under Ashoka.,Ashokan edicts and Mauryan historical records.
c. 305-272 BCE,Reign of Chandragupta Maurya,Chandragupta Maurya established diplomatic relations and cultural exchange with the Hellenistic world following Alexander's conquests.,"Historical Contact, Cultural Exchange",Creates channels for the potential transmission of ideas and cultural practices between India and the West.,Greek historical accounts and Indian sources.
c. 300-200 BCE,Development of Kharoṣṭhī script,"This script, used in Northwest India (including Gandhāra), was derived from the Persian Imperial Aramaic script, highlighting Persian linguistic influence.",Linguistic Influence,Demonstrates the lasting impact of Persian administration and culture on the writing systems of regions where Buddhism flourished.,Paleographic analysis of Kharoṣṭhī script.
c. 300-200 BCE,Jade yoga inscription artifacts,"Archaeological findings in China include jade artifacts with inscriptions detailing technical terminology for breath control, potentially reflecting early transmission of meditative practices.","Archaeological Evidence, Potential Practice Transmission","Suggests early forms of meditative or yogic practices were known in China, potentially through contact with Indian traditions.",Archaeological findings and textual analysis of inscriptions.
c. 272-232 BCE,Reign of Ashoka (Devānāṃpriya Aśoka),"In his bilingual edicts (Greek and Aramaic), Ashoka translated the Buddhist concept of dharma as eusebeia (Greek, piety/duty) and qaššīṭā (Aramaic, truth/righteousness), reflecting cross-cultural understanding and adaptation.","Linguistic Translation, Religious Adaptation",Shows the early attempts to communicate and interpret Buddhist concepts within different linguistic and cultural frameworks.,Ashokan bilingual edicts.
c. 260 BCE,Asoka's Buddhist missions,"Ashoka sent Buddhist missionaries to various regions, including potentially areas bordering China.","Historical Event, Potential Contact","Represents a significant effort to spread Buddhist teachings beyond India, potentially leading to early, indirect contact with Chinese regions.",Ashokan edicts and Buddhist chronicles.
c. 250-200 BCE,Earliest Brahmi script inscriptions,"The Brahmi script, used in the edicts of Devānāṃpriya Priyadarśi (Ashoka), provides the earliest direct written evidence of Buddhist concepts in India.",Epigraphic Evidence,Marks a crucial step in the formalization and dissemination of Buddhist teachings through written communication.,Paleographic analysis of Ashokan Brahmi inscriptions.
c. 220-206 BCE,End of Qin Dynasty,"The standardization of the Chinese writing system under the Qin Dynasty facilitated the later transcription of foreign terms, including Buddhist vocabulary.","Historical Context, Linguistic Development","Created a more unified written language in China, which would later aid in the reception and integration of Buddhist texts and concepts.",Historical accounts of the Qin Dynasty.
c. 206 BCE-9 CE,Western Han Dynasty,"The first substantial Chinese records of foreign religious practices and peoples begin to appear, including early mentions of Buddhism and śramaṇa practices.",Historical Documentation,Provides the earliest Chinese textual evidence of awareness of Buddhist traditions and practitioners.,Chinese historical records of the Han Dynasty.
c. 200-100 BCE,Spread of Buddhism to Central Asia,"Buddhist missionaries and traders carried Buddhist teachings and terms into Central Asia, where they were translated into local languages like Tocharian and Sogdian.","Cultural Diffusion, Linguistic Adaptation",Marks a significant expansion of Buddhism beyond India and the beginning of its linguistic and cultural adaptation in new regions.,Archaeological findings in Central Asia and linguistic analysis of Buddhist texts in Central Asian languages.
c. 180-150 BCE,Greek King Menander's conversations with Buddhist monk Nagasena,"Recorded in the text ""Milinda Pañha"" (Questions of Milinda), these dialogues demonstrate a direct intellectual engagement between Greek philosophical traditions and Buddhist thought.","Philosophical Exchange, Historical Dialogue",Shows a significant instance of cross-cultural philosophical exchange and the intellectual adaptability of Buddhist ideas.,"The ""Milinda Pañha"" text."
c. 100 BCE,Earliest Chinese transcriptions of śramaṇa as 沙門 (shāmén),The phonetic structure of the Sanskrit term śramaṇa is preserved in its early Chinese transliteration.,Linguistic Borrowing,Demonstrates the direct adoption of Buddhist terminology into the Chinese language.,Linguistic analysis of early Chinese Buddhist texts.
c. 50 BCE-0 CE,Development of Madhyamika philosophy,"Nāgārjuna, a key figure in this school, extensively utilized the tetralemma logic (catuskoṭi) to analyze and deconstruct philosophical views.","Philosophical Development, Conceptual Continuity",Shows the continued development and systematization of Buddhist philosophical tools that contrast with more dualistic approaches.,Nāgārjuna's philosophical treatises.
c. 2 BCE,"Emperor Ai receives ""oral teachings of Buddha""","This event marks the first official imperial record in China mentioning Buddhist concepts, albeit in a limited way.","Historical Record, Early Royal Interest",Confirms that Buddhist ideas had reached the Chinese imperial court by this time.,Chinese historical records of the Han Dynasty.
65 CE (Traditional),Traditional date of Buddhism's official introduction to China,The legend of Emperor Ming's dream and the arrival of Buddhist scriptures carried by white horses marks the traditional beginning of Buddhism's formal establishment in China.,"Historical Narrative, Symbolic Beginning","Represents a key narrative in the history of Buddhism in China, though the actual process of introduction was likely more gradual.",Chinese Buddhist historical accounts.
c. 100-200 CE,Development of vihāra (monastery) system,The institutional structure of Buddhist monasteries (vihāras) developed during this period. The term spread to Central Asia and was transcribed in Aramaic as dērā.,"Institutional Development, Linguistic Diffusion",Shows the growth of Buddhist monasticism and the spread of its terminology across different cultures and languages.,Archaeological evidence of early monasteries and linguistic analysis of Central Asian texts.
c. 100-200 CE,Development of religious Taoism (道教),"Formal religious Taoist organizations and practices emerged, incorporating elements that some scholars suggest bear resemblance to Buddhist institutional structures (e.g., monastic communities, ritual practices).","Institutional Parallel, Potential Cross-Influence",Suggests a possible influence of the developing Buddhist monastic system on the formation of organized religious Taoism.,Early Taoist religious texts and historical analyses.
c. 148-170 CE,An Shigao translates Buddhist texts into Chinese,"An early Buddhist translator used existing Taoist terminology (e.g., 道 dào for dharma, 無 wú for śūnyatā) to convey Buddhist concepts in Chinese.","Linguistic Translation, Conceptual Equivalence","Highlights the early strategies of translating Buddhist ideas by finding analogous terms in the existing Chinese philosophical lexicon, shaping the initial understanding of Buddhism in China.",Early Chinese Buddhist translations and linguistic studies.
c. 200-300 CE,Development of Vinaya (monastic code),The earliest layers of the Buddhist monastic code (Vinaya) were likely formalized during the Gupta period in India.,Institutional Development,Represents the codification of rules and practices for Buddhist monastic communities.,Buddhist Vinaya texts.
c. 200-300 CE,Emergence of Neo-Taoism (Xuanxue 玄學),"This influential philosophical movement in China saw intellectuals blending Taoist metaphysics with concepts that showed resonance with Buddhist ideas, such as emptiness and non-being.","Philosophical Synthesis, Conceptual Borrowing",Represents a conscious intellectual synthesis of indigenous Chinese thought and newly introduced Buddhist concepts.,Writings of Neo-Taoist philosophers.
c. 300-600 CE,Buddhist-Taoist debates and textual adaptations,"Ongoing intellectual and religious interactions between Buddhists and Taoists led to both competitive borrowing of ideas and practices, as well as mutual influence in textual traditions.","Religious Interaction, Intellectual Exchange","Solidifies the complex and evolving relationship between the two traditions in China, marked by both conflict and syncretism.",Historical records of religious debates and comparative textual analysis.
c. 350-450 CE,Development of Buddho-Daoist syncretic traditions,"The integration of concepts, deities, and practices from both Buddhism and Taoism led to the formation of distinct syncretic traditions within Chinese religious culture.","Religious Syncretism, Cultural Fusion",Represents a significant and lasting cultural synthesis where Buddhist and Taoist elements intertwined to create new religious expressions in East Asia.,"Archaeological findings, religious texts, and historical studies of Chinese religious history."
"This revised table incorporates the suggested columns and attempts to provide more specific information and illustrative sources. Remember that the ""Source/Evidence"" column is simplified and would ideally be filled with precise academic references in a formal setting.",,,,,
,,,,,
Let me know if you have any specific sources or further refinements in mind!,,,,,
