Period (BCE),Region/Group,Events & Developments,Cultural/Religious Significance,Key Figures,Notes & Potential Syncretism
c. 2000–1700,Hyksos (West Asia),Migration of Semitic peoples into Egypt,"Worship of Baal/Seth; early ""usurper king"" tropes",,"West Asian (Semitic, not PIE) origins. The ""usurper king"" narrative would later be paralleled in the Gaumata story, establishing a pattern of demonizing political rivals as religious imposters."
c. 1630–1530,Hyksos Egypt,Rule of Northern Egypt (Delta); capital at Avaris,Seth (Egyptian storm god identified with Baal),,"Expelled by Ahmose I; Hidden Prince motif: Hyksos rulers demonized as ""foreign tyrants."" This motif would recur in the Gaumata story and potentially influence narratives about wandering sages and hidden wisdom."
c. 1000,Scythians,Migration from Central Asia into Asian steppes,"Animism, ancestor worship, sky gods, fire rituals",,"Eastern Iranian (PIE branch); ancestral Saka kingship myths: divine horsemen linked to solar cults. These solar-deity associations would later influence Mithraic worship among Indo-Iranian peoples, establishing sun worship that bridges Mithra and later Buddhist iconography."
c. 900–800,Scythians,Migration to Pontic Steppe (north of Black Sea),"Horse sacrifices, kurgan burials",,"The ritual importance of horses in Scythian culture parallels later accounts of both Gautama Buddha's horse Kanthaka and Mithraic bull sacrifice rituals, suggesting possible common Indo-European ritual origins."
c. 800–700,Scythians/Yautiya,Settlement near Black Sea; contact with Greeks; Migration of the Yautiya tribe,Fire rituals blend with Greek/Near Eastern cults,,"Three Sisters motif: Scythian warrior-women interact with Near Eastern elites; Trial of Blood: Scythian princes prove worth via combat. The ""three trials"" concept would later appear in both Persian royal narratives and Buddhist spiritual journeys."
c. 750–700,Scythians,Settle in Ciscaucasian Steppe (Kuban river valley),"Mixed with local cultures, syncretic practices",,"Yautiya tribe, akin to the Yaudheyas, migrated due to pressures from the Medes, moving into Iran and later into the Punjab. This migration established cultural links between Iran and northern India that would later facilitate religious exchange. The name similarities between Yautiya/Yaudheya and Gautama are notable, though linguistically complex."
c. 700–600,Saka/Scythians,"Saka migrate into Central Asia, expel Scythians west",,,Rise of the Median Empire; Medes consolidated power in Western Iran. These migrations established Saka presence in regions that would later become centers of both Zoroastrian and Buddhist activity.
c. 600–550,Iranian Plateau,Zoroaster (Zarathushtra) preaches,"Early Zoroastrian concepts: dualistic cosmology, ethical conduct, future savior figure",Zoroaster,"Pre-Achaemenid; early forms of messianic expectations develop. Zoroaster's teachings about Saoshyant (future savior) established messianic concepts that would potentially influence later Mithraic and Buddhist salvific figures, including Maitreya. His emphasis on ethical conduct parallels Buddha's moral teachings."
,,,,,
,,,,,
c. 600–559,Persis,Pre-Empire Persian tribal influence grows,,Cambyses I (grandfather of Cambyses II),King of Persis. The consolidation of power under early Achaemenids created the political conditions for later religious developments across a vast territory.
c. 600–575,Persis,Birth of Cyrus the Great,,Cyrus II,"Future founder of the Achaemenid Empire. Cyrus would later be mythologized as both a liberator and divinely-favored ruler, establishing a template for benevolent kingship that influenced both political and religious narratives about ideal leadership."
575,Persis,Birth of Cassandane Shahbanu,,Cassandane,"Principal wife of Cyrus II, mother of Cambyses II and Atossa. Her death triggered empire-wide mourning, demonstrating how royal women could inspire devotion comparable to religious figures."
560–550,Persis,Birth of Bardiya (Smerdis),,Bardiya (Smerdis),"Son of Cyrus the Great, younger brother of Cambyses II. His contested identity and fate would become central to religious and political narratives about legitimacy, potentially influencing stories about hidden or misunderstood spiritual leaders like Gautama Buddha."
559,Anshan,Cyrus becomes King of Anshan,,Cyrus II,"Inherits throne of Anshan, a vassal kingdom under Median rule. Cyrus's rise from vassal to emperor parallels spiritual narratives about transformation from ordinary being to enlightened one."
550,Persia/Media,Cyrus overthrows Astyages; birth of Atossa,Establishment of the Achaemenid Empire,"Cyrus II, Astyages, Atossa","Cyrus revolts against Median overlord; Atossa (daughter of Cyrus, later wife of Cambyses II and Darius I). The overthrow of established order parallels religious narratives about spiritual revolution against entrenched dogma, as seen in both Mithraic mysteries and Buddha's challenge to Brahmanical orthodoxy."
547,Lydia,Cyrus captures Sardis,,"Cyrus II, Croesus",Defeat of Croesus brings Asia Minor under Persian control. The Lydian-Persian cultural contact introduced monetary economy concepts that would later influence both Mithraic cult finances and Buddhist monastic organization.
540,Persia,Connection between Utians and Yautiya,,,"Behistun Inscription mentions ""Vautiya"" region, connected to Herodotus's ""Utians."" These tribal connections between central Iranian plateau and northern India established pathways for religious ideas to travel between regions that would later develop Mithraism and Buddhism."
540,Persian Military,Artunis commands Persian military,,Artunis,Military leader under Cyrus II; represented Persian women's roles in warfare. Female leadership in Persian society contrasts with later religious traditions but may have influenced early Buddhist inclusion of women as disciples.
539,Babylon,Cyrus conquers Babylon; Pantea Arteshbod at Battle of Opis,,"Cyrus II, Nabonidus, Pantea Arteshbod",Incorporation of Mesopotamia; Cyrus allows Jews to return to Jerusalem; Pantea was key strategist in conquest. Cyrus's religious tolerance established a precedent for pluralism that would characterize regions where Mithraic and Buddhist ideas later flourished alongside local traditions.
538 (Mar 27),Babylon,New Year Festival Ritual,,"Cambyses II, Cyrus II",Cambyses received royal sceptre in Esagila (temple to Marduk). This ritual legitimization of rule through religious ceremony would be paralleled in later Buddhist royal patronage and Mithraic initiation ceremonies.
538 (Apr),Babylon,Cambyses appointed Governor of Northern Babylonia,,Cambyses II,"Held title ""King of Babylon, King of the Lands."" The delegation of power prefigures administrative systems that would later support religious institutions across the empire."
538 (Dec),Babylon,Cambyses dismissed from governorship,,Cambyses II,Continued to reside in Babylonian cities. This earliest recorded instance of Cambyses's unstable governance foreshadows the later instability that would allow Gaumata's rise.
,,,,,
,,,,,
530,Massagetae,Expedition against Massagetae; Death of Cyrus,,"Cyrus II, Cambyses II","Cambyses participated but was sent back to Persia before Cyrus' fatal encounter. Cyrus's death fighting eastern Iranian tribes established a narrative about the dangers of the frontier that would later color accounts of eastern religious developments. The Massagetae, related to Saka tribes, maintained religious practices connecting Iranian and Central Asian traditions."
530,Persia,Succession and Co-rulership,,Cambyses II,Appointed as co-ruler by Cyrus; carried father's body to Pasargadae for burial. The ritualized treatment of royal remains parallels later religious concepts about the sacred nature of enlightened bodies in Buddhism.
530,Persia,Controversial marriage of Atossa,Marriage reinforced dynastic purity but drew Greek condemnation,"Atossa, Cambyses II","Persian royal tradition viewed such unions as preserving ""divine bloodline."" This concept of maintaining pure lineage would later find parallels in both Mithraic initiation lines and Buddhist teacher-disciple lineages claiming direct connection to founders."
530–525,Eastern Provinces,Bardiya appointed governor of eastern provinces,,Bardiya,Included governance of Bactria. This placement of Bardiya (later known as Gaumata) in the eastern regions directly connects him to areas that would become centers of both Mithraic and Buddhist development. His time in Bactria and proximity to Gandhara would have exposed him to emerging religious ideas later associated with both traditions.
526,Egypt/Persia,Political preparations for Egyptian conquest,,"Cambyses II, Amasis II, Polycrates","Death of Amasis II weakened Egypt; Polycrates of Samos allied with Cambyses. These diplomatic maneuvers demonstrate the interconnectedness of Mediterranean and Near Eastern worlds, creating networks through which religious ideas could travel."
525,Egypt/Persia,Naval and diplomatic preparations,,Cambyses II,"Created Persian navy using Phoenician resources; treaty with Arabs to secure water supply. The logistical preparations for conquest established routes that would later facilitate spread of religious ideas, including Mithraic mysteries toward the west."
525 (Spring),Egypt,Conquest of Egypt,,"Cambyses II, Psamtik III","Defeated Egyptian forces at Pelusium; captured Memphis. This conquest brought Egyptian solar theology into contact with Persian religious ideas, potentially influencing the development of solar aspects in both Mithraism and later Buddhist iconography."
525–522,Egypt,Egyptian Rule,,Cambyses II,"Adopted Egyptian royal titles; crowned at Sais temple; claimed descent from Egyptian royalty. This religious syncretism at the highest levels set precedents for later fusion of Persian, Greek, and Indian religious concepts."
524,Egypt,Treatment of Apis Bull,"Contrary to later hostile accounts, participated in preservation ceremony",Cambyses II,"The reverential treatment of the Apis bull contradicts later Greek propaganda and demonstrates Persian respect for local animal cults. This parallels later veneration of animals in both Mithraic (bull) and Buddhist (elephant, horse) traditions."
,,,,,
,,,,,
522,Persia,Cambyses orders execution of Smerdis (disputed),,"Cambyses II, Smerdis","According to Darius's Behistun Inscription; highly disputed claim. This contested narrative about Bardiya/Smerdis's death parallels narratives of spiritual teachers who appear to die yet continue to influence followers. Some scholars speculate that if Bardiya survived and fled east, he could have encountered or even influenced emerging religious communities in regions that would later develop Buddhism."
522 (Spring),Egypt/Persia,Cambyses departs from Egypt,,"Cambyses II, Aryandes","Left to deal with rebellion; appointed Aryandes as governor of Egypt. The rebellion that drew Cambyses back was ostensibly led by Gaumata claiming to be Bardiya, establishing the pattern of contested identity that recurs in religious narratives about authentic vs. false teachers."
522,Persia,Death of Cambyses II,,Cambyses II,Died under mysterious circumstances in Syria; infected leg wound from sword when mounting horse. The mysterious death created a power vacuum that allowed Gaumata/Bardiya to claim the throne. The motif of a ruler dying from a wound parallels later religious narratives about suffering and transformation.
522 (Spring),Persia,Gaumata seizes power,,Gaumata/Bardiya,"Claims to be Bardiya and seizes power; supported by anti-Cambyses factions. Gaumata introduced religious reforms, including tax relief and changes to temple administration that some scholars compare to both Mithraic social egalitarianism and Buddha's rejection of excessive ritual costs. His brief rule represents a syncretic moment when Persian religious practice might have been steered toward more universalist tendencies similar to those that would characterize both Mithraism and Buddhism."
522,Persia,Gaumata's coup & female backlash,,"Sisygambis, noblewomen",Noblewomen reportedly funded Darius I's counter-coup. The involvement of women in preserving orthodox succession parallels the later important role of female patrons in early Buddhist communities.
522,Persia,Irdabama's economic empire,,Irdabama,"Wealthiest businesswoman; oversaw wine/grain trade across 5 regions. Her economic power demonstrates the potential for non-royal individuals to influence imperial affairs, similar to how merchants would later support Buddhist monasteries."
522 (Summer-Fall),Empire-wide,Revolts against Gaumata,,Various faction leaders,"Multiple regions resist Gaumata/Bardiya. The fragmentation of authority during this period may have allowed heterodox religious ideas to develop in provincial areas, particularly in eastern regions that would later become centers of Buddhism."
522,Persia,Revolt of Vahyazdâta,,"Vahyazdâta, Darius I, Artavardiya","Claimed to be Bardiya; many Persians supported him. The multiple claimants to Bardiya's identity suggest the powerful appeal of the reformist religious policies Gaumata/Bardiya had instituted, prefiguring the popular appeal of both Mithraic and Buddhist teachings."
522,Arachosia/Kabul,Vahyazdâta's challenge to Darius,,"Vahyazdâta, Vivana",Attempted to capture Kabul Valley; defeated by satrap of Harahvatis. The focus on controlling regions that would later become Buddhist heartlands suggests their strategic importance to the empire.
522,Persia,Battle at Rakhâ,,"Vahyazdâta, Artavardiya",Artavardiya suppressed Vahyazdâta's rebellion. The systematic suppression of Bardiya-claimants established a pattern of orthodoxy triumphing over reform that would be mirrored in later religious conflicts.
522 (Sep 29),Sikayauvati,Assassination of Gaumata,,"Darius I, six Persian nobles","Palace coup at Sikayauvati. The violent overthrow of Gaumata mirrors the later Buddhist narrative of Mara's assault on the Buddha, with Darius potentially serving as a template for forces opposing spiritual revolution. Some scholars speculate that if Gaumata survived (as later rumors suggested), his flight eastward could connect to emergence of wandering teachers in northwestern India."
522 (Oct-Dec),Empire-wide,Rebellions against Darius,,Various leaders,"Elam, Media, and Persia see uprisings. The widespread resistance to Darius suggests Gaumata/Bardiya's reforms had significant popular support, similar to how both Mithraic and Buddhist teachings would later appeal to various social classes seeking alternatives to established orders."
,,,,,
,,,,,
521 (Mar 12),Persia,Vahyazdata rises in Persia,,Vahyazdata,"Persian rebel claiming to be Bardiya; rose in Tārvā (Yautiya district). The persistent emergence of Bardiya-claimants suggests a messianic quality attributed to him, potentially influencing later concepts of returning savior figures in both Mithraic (Mithra's return) and Buddhist (Maitreya) traditions."
521 (May 24),Persia,Battle of Rakhâ,,"Vahyazdata, Artavardiya",Vahyazdata's forces defeated by Darius' general. The repeated military suppression of reform movements established a pattern of orthodoxy using force against religious innovation.
521,Persia,Battle at Parga,,"Vahyazdâta, Artavardiya",Vahyazdâta fled after defeat but gathered another army. The persistence of resistance despite defeats parallels narratives about religious communities surviving persecution.
521 (Jul 15),Persia,Battle of Parga,,"Vahyazdata, Artavardiya",Vahyazdata defeated and captured. His capture represents the temporary triumph of imperial orthodoxy over reform movements.
521,Arachosia,Second battle in Arachosia,,"Vahyazdâta's commander, Vivâna",Rebels regrouped but defeated at Gandutava. The focus on controlling Arachosia (near Gandhara) highlights the region's importance as a frontier zone where heterodox ideas could flourish.
521 (Aug-Sep),Uvâdaicaya,Execution of Vahyazdâta,,Vahyazdâta,Crucified with chief supporters in Uvâdaicaya. The public execution through crucifixion established a martyrdom narrative that parallels later religious stories about persecution of truth-bringers. Some scholars note similarities between these executions and later accounts of religious persecution in both western and eastern traditions.
521 (Dec 29),Kapishkanish,Rebel forces defeated,,Vivâna,"Forces sent by Vahyazdata defeated at Kapishkanish (Kandahar). This region would later become a crucial center for Buddhist development, suggesting continuity between political resistance to imperial orthodoxy and religious innovation."
521 (Feb 21),Gandutava,Final battle at Gandutava,,Vivâna,"Remaining rebels loyal to Vahyazdata crushed. Despite military defeat, the ideals associated with Gaumata/Bardiya may have survived among displaced populations moving eastward."
521 (Spring),Arachosia,Last supporters hunted down,,,"Final elimination of Vahyazdâta's supporters. The thorough persecution may have forced surviving adherents to flee further east, potentially carrying syncretic religious ideas into regions where Buddhism would later develop."
520 onwards,Empire-wide,Darius consolidates power,,Darius I,"Executes further rivals; establishes legitimacy. Darius's narrative about defeating the ""false Bardiya"" created a template for religious orthodoxy defining itself against ""illegitimate"" teachers that would reappear in later religious polemics."
518,Persia,Atossa's political influence peaks,,"Atossa, Darius I","Persuaded Darius to name Xerxes as heir over older half-brothers. Her influence demonstrates how Cyrus's bloodline maintained sacred status even after the purging of Bardiya/Gaumata, paralleling how religious lineages maintain authority through selective interpretation of founder's legacies."
,,,,,
,,,,,
c. 550–530,"Bactria, Gandhara, Sogdiana",Cyrus expands east; builds fortresses against Saka; defeats Saka Haumavarga,Zoroastrianism (Mazdaism) introduced; local traditions persist,Cyrus II,"Achaemenid control established over eastern Iranian and northwestern Indian regions. This expansion brought Persian religious concepts into direct contact with Indic traditions, creating the syncretic environment where both Mithraic mysteries and early Buddhism would develop. The Saka Haumavarga (""haoma-drinking Saka"") practiced rituals involving sacred beverages that parallel both Mithraic ritual feasts and early Buddhist discussions of soma."
c. 522–486,"Gandhara, Bactria, Arachosia, Sattagydia, Sindhu",Darius consolidates Achaemenid rule; regions listed in Behistun Inscription,"Zoroastrianism and Iranian cults (e.g., Mithra) spread; syncretism with local beliefs",Darius I,"Taxila (Takṣaśila) becomes major center for learning and religious exchange. If Gaumata/Bardiya did escape east after being deposed, this period coincides with the traditional dating of Buddha's lifetime, raising speculative connections between Persian religious reformers and emerging Buddhist teachings. Taxila's importance as a learning center could have facilitated transmission of ideas between Persian and Indian traditions."
c. 520–518,Eastern Saka (Massagetae/Saka Tigraxauda),Darius's campaigns against Saka; captures King Skunxa,,"Darius I, Skunxa","Territories incorporated into Achaemenid Empire as part of Chorasmia. The eastern campaigns brought Persian administrative systems into regions where both Mithraic and Buddhist ideas would flourish, potentially creating conditions for syncretism between Persian royal ideology and indigenous spiritual practices."
c. 513,Pontic Scythians,Darius's Scythian Expedition across the Danube,,Darius I,"Outcome debated; some Achaemenid authority may have been established. The westward campaigns demonstrated Persian interest in controlling Scythian/Saka populations in all directions, potentially influencing how Mithraic ideas would later spread both east and west from Persian heartlands."
c. 500–400,"Gandhara, Kashmir, Punjab",Achaemenid administration; Persian satraps govern,Zoroastrian and Mithraic cults influence local practices; Buddhist and Jain ideas emerge,,"Early Buddhist concepts show possible Mazdean influence. This century of Persian administrative control coincides with the traditional period of early Buddhist development, suggesting opportunities for Persian religious concepts to influence emerging Buddhist teachings. Concepts potentially shared between traditions include cosmic dualism, ethical focus, and messianic expectations. The name similarities between Gaumata and Gautama, while linguistically distinct, have prompted speculation about narrative parallels between the Persian reformer and the Buddha."
500,"Punjab, Rajasthan",Settlement of Rohitas and Yautiya,,"Rohitas, Yautiya","Settled in East Punjab, Rajasthan, later in Rohilkhand, Uttar Pradesh. These tribal settlements may have carried memories of the Gaumata affair and Persian religious concepts into regions that would become centers of Buddhist activity."
500,Greek Accounts,Rise of incest accusations,,,"Greek historians allege royal intermarriage; modern scholars argue claims exaggerated. The Greek polemics against Persian customs parallels how orthodox traditions often demonize heterodox religious movements, a pattern seen in both Darius's treatment of Gaumata and later religious polemics against Mithraism and early Buddhism."
,,,,,
,,,,,
480,Persia,Artaynte affair,,"Artaynte, Xerxes I",Alleged affair with Xerxes led Masistes to rebel; Xerxes executed Masistes and sons. The court intrigues demonstrate continuing tensions within the Achaemenid dynasty that may have influenced religious narratives about moral corruption and renewal.
5th–4th c.,Various Saka Tribes,Saka tribes listed as Achaemenid subjects,,,"Supplying troops and tribute; some act as allies, others maintain autonomy. The incorporation of Saka troops into Persian armies facilitated cultural exchange, potentially spreading both Mithraic and emerging Buddhist ideas along military routes. The Saka's semi-autonomous status allowed them to maintain distinct religious practices that could bridge Persian and Indian traditions."
c. 400–330,"Gandhara, Bactria, Arachosia, Sogdiana",Saka and Scythian migrations intensify; Achaemenid control wanes,"Religious syncretism: Greek, Iranian, and Indian elements merge",,"Zoroastrian sanctuaries found in Taxila; Mithra worship persists among Saka. This period of religious mixing coincides with the development of Mahayana Buddhism, which incorporates more explicit savior concepts similar to those in Mithraic tradition. The continued presence of Mithra worship among Saka tribes provides a potential link between Persian religious concepts and developing Buddhist ideas about cosmic buddhas and bodhisattvas."
336,Persia,Sisygambis' diplomatic role,,Sisygambis,"Mother of Darius III; after defeat by Alexander, negotiated family's safety. Her role demonstrates the continuing importance of royal women in Persian politics, a pattern that would influence how female patronage operated in later religious traditions."
c. 330,Saka territories,Saka oppose Alexander the Great,,,Sometimes allying with Bactrians and Sogdians against him. The resistance to Hellenization demonstrates continuing Indo-Iranian cultural solidarity that would influence how both Mithraic and Buddhist traditions incorporated or resisted Greek elements.
,,,,,
,,,,,
c. 330–250,"Gandhara, Bactria, Punjab, Kashmir",Alexander conquers region; Greek satraps established,Buddhism flourishes under Indo-Greek and Saka patronage,,"Gandhara art blends Greek, Iranian, and Buddhist motifs. The iconographic development of Buddha images during this period shows striking parallels to Mithraic imagery, including solar halos, royal postures, and cosmic symbolism. Some scholars suggest the story of Gaumata's brief rule and violent overthrow may have influenced Buddhist narratives about opposition to enlightened teaching."
c. 250–100,Bactria,Indo-Greek and Saka kingdoms rise,"Maitreya concept develops, possibly influenced by Mithraic messianic ideas",,"The concept of Maitreya, the future Buddha, emerges. Maitreya's development as a messianic figure parallels both Zoroastrian Saoshyant and Mithraic savior concepts, suggesting potential influence from Persian religious traditions transmitted through Saka intermediaries. The name ""Maitreya"" itself relates linguistically to Mithra, suggesting possible conceptual borrowing between traditions."
c. 100 BCE–100 CE,Kushan Empire,Saka-Kushan rulers adopt Buddhism,Development of Mahayana Buddhism; Maitreya becomes important,Kushan kings,"Royal Messiahs: Kushan kings claim divine lineage. Kushan royal ideology blended Iranian concepts of divine kingship with Buddhist patronage, creating syncretism at the highest political levels. Some kings used titles like ""Son of Heaven"" that echo both Persian and Chinese imperial terminology while supporting Buddhist institutions."
