Timeline of Brennus and the Celtic Invasions,,
"Brennus (Leader of the Senones, Sack of Rome)",,
Year,Event,Details
391 BCE,Battle of Clusium,"The Senones, led by Brennus, attack Clusium, an Etruscan city, after a dispute. The Romans intervene, angering the Gauls."
390 BCE,Battle of the Allia,"Brennus defeats the Roman army at the Allia River, marking one of Rome's greatest defeats."
390 BCE,Sack of Rome,Brennus and the Senones enter Rome and plunder the city. The Romans take refuge on the Capitoline Hill.
390 BCE,"""Vae Victis"" (Woe to the Vanquished)","When the Romans offer gold to end the siege, Brennus famously throws his sword onto the scales, demanding more tribute."
390 BCE,End of the Sack of Rome,"According to legend, Marcus Furius Camillus leads a Roman counterattack, forcing the Gauls to withdraw."
After 390 BCE,Brennus' Fate Uncertain,"Accounts vary—some say he retreats to Gaul, others that he is killed in battle."
"Brennus (Leader of the Gauls, Invasion of Greece)",,
Year,Event,Details
281 BCE,Celtic Migrations into the Balkans,"Celtic tribes move southward from Central Europe, threatening the Greek world."
279 BCE,Brennus Leads Gallic Invasion of Greece,Brennus becomes the leader of a large Gallic force and marches into Greece.
279 BCE,Battle of Thermopylae,"Brennus attacks the Greek coalition at Thermopylae, eventually bypassing their defenses."
279 BCE,Attack on Delphi,"Brennus leads his forces to plunder the Oracle of Delphi, seeking its legendary riches."
279 BCE,Defeat at Delphi,"The Greeks, aided by a sudden snowstorm and rockslides, repel the Gauls. Some sources claim divine intervention."
279 BCE,Brennus' Death,"Wounded in battle and unable to recover, Brennus reportedly takes his own life."
278 BCE,Surviving Gauls Settle in Anatolia,The remnants of Brennus' army later become the Galatians of Asia Minor.
Legacy and Mythology,,
Era,Event,Details
Roman Tradition,Demonization of Brennus,"Roman historians depict Brennus as a ruthless barbarian, symbolizing Rome’s vulnerability."
Greek Tradition,Delphi’s Divine Defense,Greek sources claim Apollo sent a storm to punish the Gauls for attacking the sacred site.
Medieval Europe,Brennus as a Legendary King,"In medieval chronicles, Brennus is sometimes merged with later Celtic warrior figures."
,,
,,
,,
I'll expand the timeline with more details and events while maintaining the same table structure:,,
,,
Timeline of Brennus and the Celtic Invasions,,
"Brennus (Leader of the Senones, Sack of Rome)",,
Year,Event,Details
400-391 BCE,Celtic Migrations into Italy,"Senones and other Gallic tribes cross the Alps and settle in northern Italy, establishing a presence in the Po Valley region"
391 BCE,Battle of Clusium,"The Senones, led by Brennus, attack Clusium, an Etruscan city, after a dispute. The Romans intervene, angering the Gauls"
390 BCE,Roman Ambassadors Violation,"Roman ambassadors, sent to mediate at Clusium, break their neutrality and join the battle against the Gauls, provoking Brennus to march on Rome"
390 BCE,Battle of the Allia,"Brennus defeats the Roman army at the Allia River on July 18, marking one of Rome's greatest defeats"
390 BCE,Romans Abandon the City,"Most citizens flee Rome, with only a small garrison remaining on the Capitoline Hill"
390 BCE,Sack of Rome,Brennus and the Senones enter Rome and plunder the city for several months. The Romans take refuge on the Capitoline Hill
390 BCE,The Capitoline Geese,"Sacred geese in the Temple of Juno alert Romans to a Gallic night attack on the Capitoline Hill, saving the last Roman stronghold"
390 BCE,"""Vae Victis"" (Woe to the Vanquished)","When the Romans offer gold to end the siege, Brennus famously throws his sword onto the scales, demanding more tribute"
390 BCE,End of the Sack of Rome,"According to legend, Marcus Furius Camillus leads a Roman counterattack, forcing the Gauls to withdraw"
389-387 BCE,Gallic Retreat,"Brennus and his forces withdraw from Roman territory, taking their plunder back north"
After 387 BCE,Roman Rebuilding,"Romans rebuild their city with hasty, unplanned construction, leading to Rome's infamous narrow streets"
385-370 BCE,Brennus' Fate Uncertain,"Accounts vary—some say he retreats to Gaul, others that he is killed in battle or dies of illness"
"Brennus (Leader of the Gauls, Invasion of Greece)",,
Year,Event,Details
281-280 BCE,Celtic Migrations into the Balkans,"Large Celtic tribes move southward from Central Europe into Thrace and Macedonia, threatening the Greek world"
280 BCE,Battle of Lysimachia,"Celts defeat Macedonian forces under Ptolemy Keraunos, who is killed in battle"
280 BCE,Brennus Emerges as Leader,Brennus consolidates power among the Celtic tribes and proposes an invasion of rich Greek sanctuaries
279 BCE,Formation of Greek Coalition,Greek city-states form an alliance to defend against the Celtic invasion
279 BCE,Brennus Assembles a Massive Force,"Brennus gathers approximately 152,000 infantry and 20,400 cavalry (according to Pausanias, likely exaggerated)"
279 BCE,Invasion of Thessaly,"Celtic forces enter Greece through Thessaly, pillaging as they advance"
279 BCE,Battle of Thermopylae,"Brennus attacks the Greek coalition at Thermopylae. After initial failure, he finds a path around the Greek position, similar to the Persian maneuver in 480 BCE"
279 BCE,Division of Celtic Forces,"Brennus divides his army, sending Acichorius with part of the force to raid Aetolia, drawing away Greek defenders"
279 BCE,Aetolian Resistance,"Aetolians successfully defend their territory, inflicting heavy casualties on Celtic raiders"
279 BCE,March to Delphi,"Brennus leads approximately 40,000 warriors toward Delphi and its legendary treasures"
279 BCE,Battle at Mount Parnassus,Greeks harass the advancing Celtic forces with skirmish tactics in the mountains
279 BCE,Attack on Delphi,"Brennus leads his forces to plunder the Oracle of Delphi, seeking its legendary riches"
279 BCE,Defeat at Delphi,"The Greeks, aided by a sudden snowstorm and rockslides, repel the Gauls. Some sources claim divine intervention by Apollo"
279 BCE,Brennus' Death,"Wounded in battle and unable to recover, Brennus reportedly takes his own life by drinking undiluted wine or falling on his sword"
278 BCE,Celtic Retreat,"Acichorius leads the surviving Celts northward, harassed by Greek forces"
278-277 BCE,Surviving Gauls Cross to Asia Minor,"Upon invitation from Nicomedes I of Bithynia, remaining Celtic forces cross the Hellespont"
277-275 BCE,Galatian Settlement,"The remnants of Brennus' army later become the Galatians, settling in central Anatolia"
Legacy and Mythology,,
Era,Event,Details
Roman Tradition,Demonization of Brennus,"Roman historians depict Brennus as a ruthless barbarian, symbolizing Rome's vulnerability"
Roman Republic,Military Reforms,The sack of Rome leads to significant military reforms and the construction of the Servian Walls
Roman Calendar,Dies Alliensis,"July 18, the date of the Battle of Allia, becomes marked as a day of ill omen in the Roman calendar"
Greek Tradition,Delphi's Divine Defense,"Greek sources claim Apollo sent a storm to punish the Gauls for attacking the sacred site, with appearances of divine warriors"
Hellenistic Period,"""Galatophobia""","Fear of Celtic warriors influences Greek military strategy and art, with the emergence of ""Dying Gaul"" sculptures"
Galatian Kingdom,Celtic Culture in Asia Minor,Galatians preserve Celtic language and customs in Anatolia for several centuries
Galatian Christianity,St. Paul's Epistle,"St. Paul writes his Epistle to the Galatians, addressing descendants of these Celtic settlers"
Medieval Europe,Brennus as a Legendary King,"In medieval chronicles, particularly Geoffrey of Monmouth, Brennus is sometimes merged with later Celtic warrior figures"
Renaissance,Revival of Classical Sources,Renewed interest in Livy and Polybius brings the Brennus stories back to prominence
Modern Nationalism,Celtic Heritage,Both Brennus figures become symbols of Celtic resistance against Mediterranean powers in modern nationalist narratives
,,
,,
,,
Expanded Timeline of Brennus and Celtic Prehistory (2000 BCE - 279 BCE),,
Proto-Celtic Origins and Bronze Age (2000-800 BCE),,
Year,Event,Details
2000-1800 BCE,Unetice Culture,"Early Bronze Age culture in Central Europe develops sophisticated metallurgy, possibly proto-Indo-European speaking"
1800-1600 BCE,Tumulus Culture,"Burial mound tradition spreads across Central Europe, showing early cultural unification"
1600-1200 BCE,Urnfield Culture Emerges,Cremation burial practices spread across Europe; considered a possible proto-Celtic cultural phase
1400-1200 BCE,Bronze Age Trade Networks,"Extensive trade routes link Central Europe with Mediterranean civilizations, introducing new technologies and cultural practices"
1200-1000 BCE,Climate Deterioration,"Cooler, wetter conditions in Europe lead to population movements and cultural adaptations"
1000-800 BCE,Proto-Celtic Language Development,Linguistic evidence suggests the differentiation of Proto-Celtic from other Indo-European languages during this period
900-800 BCE,Early Hillforts,"First defensive settlements appear in Central Europe, indicating increasing social complexity and conflict"
Early Iron Age and Hallstatt Culture (800-450 BCE),,
Year,Event,Details
800-700 BCE,Hallstatt C Period Begins,"Iron technology becomes widespread in Central Europe, revolutionizing agriculture and warfare"
750-700 BCE,Early Celtic Chiefdoms,Social stratification increases with emergence of warrior elites controlling trade and resources
700-650 BCE,Mediterranean Contact Intensifies,"Greek and Etruscan luxury goods begin appearing in elite Celtic burials, indicating trade connections"
650-600 BCE,Heuneburg Settlement,Major fortified settlement along the Danube becomes a center of Celtic culture and Mediterranean trade
600-550 BCE,Hallstatt D Period,"Development of elaborate ""princely"" burials indicating concentration of wealth and power"
550-500 BCE,Vix Burial,Spectacular elite female burial in Burgundy region demonstrates extensive Mediterranean connections
500-450 BCE,Hallstatt Decline,"Traditional Hallstatt centers decline, possibly due to shifting trade routes or internal social changes"
La Tène Culture and Celtic Expansion (450-300 BCE),,
Year,Event,Details
450-400 BCE,La Tène Culture Emerges,"New artistic style and cultural practices develop in Celtic Europe, named after discoveries at La Tène, Switzerland"
430-400 BCE,Celtic Expansion Begins,Increased population and social pressures lead to outward migration from Central Europe
400-390 BCE,First Celtic Crossings into Italy,"Early Celtic groups cross the Alps and settle in the Po Valley, encountering Etruscan civilization"
400-390 BCE,Senones Tribe Migration,"The Senones, a Celtic tribe from the area of modern eastern France, move into northeastern Italy"
Brennus I: Early Life and Rise (Fictional/Speculative Based on Celtic Customs),,
Year,Event,Details
430-420 BCE,Birth of Brennus I,Born into a noble Senones family in Transalpine Gaul (modern eastern France)
425-415 BCE,Childhood in Tribal Society,Raised in warrior traditions with emphasis on physical prowess and martial skills
420-410 BCE,Father's Position,"Son of a respected warrior-chief named Brianos (speculative), who led his clan in early migrations"
415-405 BCE,Fosterage Period,"According to Celtic custom, sent to foster with allied family to learn leadership and warrior skills"
410-400 BCE,First Raids,"Participates in first raids against neighboring tribes, displaying leadership abilities"
405-395 BCE,Marriage Alliance,"Marries daughter of influential Senones chief, strengthening his position within the tribe"
400-395 BCE,Migration Decision,Participates in tribal council decision to migrate across the Alps seeking new lands
395-393 BCE,Journey to Italy,Leads a portion of the Senones tribe across the Alps into the Po Valley of northern Italy
393-392 BCE,Early Italian Settlements,Establishes Senones settlements in what becomes known as Cisalpine Gaul
392-391 BCE,Rise to Tribal Leadership,"Following his father's death or retirement, emerges as chief of the Senones in Italy"
Brennus I: The Roman Conflict (391-385 BCE),,
Year,Event,Details
391 BCE,Clusium Dispute,Conflict begins with Etruscan city of Clusium over land and resources
391 BCE,Roman Diplomatic Involvement,Romans send Fabii brothers as ambassadors to mediate the dispute
391 BCE,Diplomatic Incident,Roman ambassadors violate neutrality by joining battle against Gauls
391 BCE,Brennus Demands Justice,Sends messengers to Rome demanding the Fabii be handed over for their violation
390 BCE,Roman Refusal,"Rome refuses to punish the Fabii, instead electing them as military tribunes"
390 BCE,Decision to March on Rome,Brennus gathers war council and decides to punish Rome directly
390 BCE,March to Rome,"Leads approximately 30,000 warriors southward toward Rome"
"July 18, 390 BCE",Battle of the Allia,"Ambushes and crushes Roman army at the Allia River, opening path to Rome"
"July 19-20, 390 BCE",Entry into Rome,Finds Rome largely abandoned except for the Capitoline Hill
July-November 390 BCE,Siege of Capitoline,Besieges last Roman defenders on the Capitoline Hill for several months
November 390 BCE,"""Vae Victis"" Incident","When weighing gold tribute, throws his sword on scales saying ""Woe to the vanquished"""
November 390 BCE,Departure from Rome,"Leaves Rome with plunder, either due to disease, food shortages, or threats to their homeland"
389-387 BCE,Return to Senones Territory,"Distributes plunder, strengthening his position among Celtic tribes in northern Italy"
387-385 BCE,Later Career,Consolidates Senones territory in northeastern Italy
385 BCE,Fate of Brennus I,"Disappears from historical record, possibly died of natural causes or in subsequent conflicts"
Celtic World Between the Two Brennus Leaders (385-280 BCE),,
Year,Event,Details
385-370 BCE,Roman Recovery,Romans rebuild their city and begin to develop stronger military organization
370-350 BCE,Italian Gallic Confederacy,Celtic tribes in northern Italy form loose confederations for mutual defense
367 BCE,Licinan-Sextian Laws,Roman military reforms partially in response to Gallic threat
360-340 BCE,Celtic Mercenary Service,Italian Gauls begin serving as mercenaries for various Mediterranean powers
350-330 BCE,La Tène Culture Peak,Celtic art and craftsmanship reaches its peak in homeland territories
340-330 BCE,Alexander the Great's Celtic Encounter,"Alexander meets with Celtic ambassadors who claim to fear only that ""the sky might fall"""
335 BCE,First Balkan Celtic Incursions,Small Celtic groups begin probing the northern Balkans
330-310 BCE,Expansion into Eastern Europe,"Celtic groups expand into what is now Hungary, Romania, and Serbia"
310-300 BCE,Rome vs Etruscans,"Romans engage in wars with Etruscans, sometimes employing Celtic mercenaries"
300-290 BCE,Danubian Celtic Kingdoms,Powerful Celtic kingdoms established along the Danube River
298-290 BCE,Third Samnite War,"Rome secures dominance over central Italy, bringing them closer to Gallic territories"
285-282 BCE,Political Instability in Macedon,"After death of Lysimachus, Macedonian kingdom experiences succession struggles"
281-280 BCE,Celtic Tribal Confederation Forms,Large confederation of Celtic tribes gathers on the northern borders of Greece
Brennus II: Early Life and Rise (Fictional/Speculative Based on Celtic Customs),,
Year,Event,Details
320-310 BCE,Birth of Brennus II,Born into a powerful clan of the Prausi or Tectosages tribe in Danubian region
315-305 BCE,Childhood in Migrating Tribe,Raised during period of tribal migration and warfare in Eastern Europe
310-300 BCE,Family Background,Son of successful war leader who expanded tribal territory eastward
305-295 BCE,Warrior Training,Undergoes traditional training in Celtic warrior arts
300-290 BCE,First Military Campaigns,Participates in raids against Illyrian and Thracian peoples
295-285 BCE,Rise Within Tribal Hierarchy,Gains reputation through successful raids and personal combat
290-285 BCE,Leadership of War Band,Commands personal war band (comitatus) attracting warriors with success and plunder
285-282 BCE,Tribal Leadership,Becomes chief of his tribe through combination of military success and political alliances
282-281 BCE,Vision of Southern Conquest,"Promotes idea of invasion of Macedonia and Greece, citing their wealth and internal divisions"
281-280 BCE,Formation of Tribal Coalition,Successfully unites various Celtic tribes under his leadership for southern campaign
Brennus II: The Greek Invasion (280-279 BCE),,
Year,Event,Details
Early 280 BCE,Initial Balkan Campaign,Leads invasion force of multiple Celtic tribes southward into Thrace
Summer 280 BCE,Battle of Lysimachia,"Celtic forces defeat Macedonian army, kill King Ptolemy Keraunos"
Late 280 BCE,Division of Forces,Some Celtic groups under Cerethrius and Bolgius raid Thrace and Macedonia
Winter 280-279 BCE,Planning Greek Invasion,"Winters in captured territories, gathers intelligence on Greek defenses"
Early 279 BCE,Massive Force Assembly,"Organizes largest Celtic army yet seen in the region (claimed 152,000 infantry by ancient sources)"
Spring 279 BCE,Thessalian Invasion,"Leads forces into Thessaly, defeating local resistance"
June 279 BCE,Greek Coalition Forms,Greek states form defensive alliance against Celtic invasion
Summer 279 BCE,Initial Assault on Thermopylae,First attack on Greek position at Thermopylae is repulsed
August 279 BCE,Bypass Maneuver,Discovers mountain path around Thermopylae (similar to Persian invasion route)
August 279 BCE,Tactical Division,Sends Acichorius with part of army to raid Aetolia as diversion
September 279 BCE,March on Delphi,"Leads approximately 40,000 warriors toward Delphi Oracle and its treasures"
October 279 BCE,Mountain Harassment,Greek forces harass Celtic army with skirmish tactics in mountainous terrain
Late October 279 BCE,Battle of Delphi,Attacks sanctuary of Delphi but faces fierce Greek resistance
Late October 279 BCE,"The ""Divine Intervention""","Massive storm with lightning, rockslides, and earthquake disrupts Celtic attack"
October/November 279 BCE,Defeat and Wounding,Severely wounded during battle at Delphi
November 279 BCE,Death of Brennus II,"Unable to recover from wounds, reportedly takes his own life"
Winter 279-278 BCE,Celtic Retreat,"Surviving forces under Acichorius retreat northward, harassed by Greek forces"
Aftermath and Celtic Legacy (278 BCE - Later Influences),,
Year,Event,Details
278-277 BCE,Invitation to Asia Minor,Nicomedes I of Bithynia invites Celtic mercenaries to cross to Asia Minor
277 BCE,Crossing to Anatolia,"Approximately 20,000 Celtic survivors cross the Hellespont"
277-275 BCE,Service in Bithynia,"Celts serve Nicomedes in his civil war, gaining reputation as fierce warriors"
275 BCE,Battle of Elephants,Seleucid king Antiochus I defeats Galatians using war elephants
274-262 BCE,Galatian Settlement,"Celtic tribes settle in central Anatolia, establishing the region later known as Galatia"
241-240 BCE,Attalid Victory,"Attalus I of Pergamon defeats Galatians, commissioning famous ""Dying Gaul"" sculptures"
225 BCE,Battle of Telamon,"Romans defeat Cisalpine Gauls in Italy, beginning final conquest of Po Valley"
191 BCE,Roman-Galatian Conflict,"Romans under Manlius Vulso invade Galatia, subjugating the region"
64 BCE,Galatia Becomes Client Kingdom,"Pompey reorganizes East, making Galatia a Roman client state"
49-45 BCE,Caesar's Gallic Accounts,"Julius Caesar publishes his ""Gallic Wars,"" shaping Roman view of Celts"
25 BCE,Galatia Becomes Roman Province,Emperor Augustus converts Galatia into a formal Roman province
48-52 CE,Galatian Christianity,St. Paul visits and writes Epistle to the Galatians
92-94 CE,Tacitus's Germania,Roman historian Tacitus records information about Celtic and Germanic peoples
12th Century CE,Geoffrey of Monmouth,Medieval chronicler incorporates Brennus into legendary British history
18th-19th Century CE,Celtic Revival,Romantic nationalist movements revive interest in Celtic heritage
20th Century CE,Archaeological Discoveries,Modern archaeology reveals actual extent and sophistication of Celtic civilization
,,
,,
,,
,,
Comprehensive Timeline of Ancient Migration and Celtic History,,
"Prehistoric Migrations (10,000 BCE - 3000 BCE)",,
Year,Event,Details
"10,000 BCE",Post-Ice Age Migration,Migration from the Middle East to Europe begins after the last ice age (needs confirmation)
5800 BCE,Celtic Ancestors Arrive,Ancient Celtic ancestors arrive in the British Isles and Western Europe from the Steppes; white skin genetics arrive in Europe with Middle Easterners and Central Asians (needs confirmation)
3300-2600 BCE,Yamnaya Culture,"The Yamnaya (Pit Grave/Ochre Grave) culture develops between the Southern Bug, Dniester, and Ural rivers in the Pontic–Caspian steppe; characterized by distinctive burial traditions in tumuli (kurgans) containing simple pit chambers"
3600-3400 BCE,Core Yamnaya Culture,"Mikhaylovka, in lower Dnieper river, Ukraine, formed the Core Yamnaya culture"
Early Bronze Age (3000 BCE - 2000 BCE),,
Year,Event,Details
2300 BCE,Hurrian Emergence,Hurrians established in the Near East region; King Tupkish of Urkesh (with a Hurrian name) recorded on clay sealing
2100 BCE,First Hurrian Inscription,"First recorded inscription of Hurrian language by Tish-atal, king of Urkesh"
2000-1800 BCE,Unetice Culture,"Early Bronze Age culture in Central Europe develops sophisticated metallurgy, possibly proto-Indo-European speaking"
Middle Bronze Age (2000 BCE - 1500 BCE),,
Year,Event,Details
1835 BCE,Biblical Migration,"In Biblical record, Jacob and his family migrate to Egypt due to famine in Canaan"
1781 BCE,Canaanite Migration,"Canaanites, including future Hyksos, migrate to Egypt due to famine"
1750-1650 BCE,Semitic Influx,Gradual influx of Semitic peoples into Egypt's eastern Delta region
1800-1600 BCE,Tumulus Culture,"Burial mound tradition spreads across Central Europe, showing early cultural unification"
1600 BCE,Mitanni Formation,"Emergence of Mitanni state (Hanigalbat/Hani-Rabbat in Assyrian records, Naharin in Egyptian texts) in northern Syria and southeast Anatolia with Hurrian-speaking population and Indo-Aryan linguistic influences"
1600-1550 BCE,Mitanni Expansion,"At its maximum extent, Mitanni ranged from Kizzuwatna by the Taurus Mountains in the west to Tunip in the south, Arraphe in the east, and north to Lake Van"
Late Bronze Age (1550 BCE - 1200 BCE),,
Year,Event,Details
1600-1200 BCE,Proto-Hyksos Era,The Hyksos control northern Egypt before being expelled and migrating northward; theorized to have carried Mesopotamian religious symbols into Central Asia
1550-1260 BCE,Mitanni Empire,"Mitanni becomes a strong regional power, limited by the Hittites to the north, Egyptians to the west, Kassites to the south, and later by the Assyrians to the east"
1544 BCE,Exodus,Prince Moses leads the Exodus of Hebrews who recognize Abraham
1533 BCE,Hyksos Expulsion,Expulsion of remaining Hyksos from Egypt to Canaan
1530-1240 BCE,Israelite Enslavement,"Period of enslavement for Israelites remaining in Egypt, according to some interpretations"
1600-1200 BCE,Urnfield Culture Emerges,Cremation burial practices spread across Europe; considered a possible proto-Celtic cultural phase
1400-1200 BCE,Bronze Age Trade Networks,Extensive trade routes link Central Europe with Mediterranean civilizations
1200-1000 BCE,Climate Deterioration,"Cooler, wetter conditions in Europe lead to population movements and cultural adaptations"
Early Iron Age (1200 BCE - 800 BCE),,
Year,Event,Details
1000-800 BCE,Proto-Celtic Language Development,Linguistic evidence suggests the differentiation of Proto-Celtic from other Indo-European languages
900-800 BCE,Early Hillforts,"First defensive settlements appear in Central Europe, indicating increasing social complexity"
Hallstatt Period (800 BCE - 450 BCE),,
Year,Event,Details
800-700 BCE,Hallstatt C Period Begins,"Iron technology becomes widespread in Central Europe, revolutionizing agriculture and warfare"
750-700 BCE,Early Celtic Chiefdoms,Social stratification increases with emergence of warrior elites controlling trade and resources
700-650 BCE,Mediterranean Contact Intensifies,Greek and Etruscan luxury goods begin appearing in elite Celtic burials
650-600 BCE,Heuneburg Settlement,Major fortified settlement along the Danube becomes a center of Celtic culture and Mediterranean trade
600-550 BCE,Hallstatt D Period,"Development of elaborate ""princely"" burials indicating concentration of wealth and power"
550-500 BCE,Vix Burial,Spectacular elite female burial in Burgundy region demonstrates extensive Mediterranean connections
500-450 BCE,Hallstatt Decline,"Traditional Hallstatt centers decline, possibly due to shifting trade routes or internal social changes"
La Tène Culture and Celtic Expansion (450 BCE - 300 BCE),,
Year,Event,Details
450-400 BCE,La Tène Culture Emerges,New artistic style and cultural practices develop in Celtic Europe
430-400 BCE,Celtic Expansion Begins,Increased population and social pressures lead to outward migration from Central Europe
400-390 BCE,First Celtic Crossings into Italy,"Early Celtic groups cross the Alps and settle in the Po Valley, encountering Etruscan civilization"
400-390 BCE,Senones Tribe Migration,"The Senones, a Celtic tribe from the area of modern eastern France, move into northeastern Italy"
Brennus I: Early Life and Rise (Speculative Based on Celtic Customs),,
Year,Event,Details
430-420 BCE,Birth of Brennus I,Born into a noble Senones family in Transalpine Gaul (modern eastern France)
