425-415 BCE,Childhood in Tribal Society,Raised in warrior traditions with emphasis on physical prowess and martial skills
420-410 BCE,Father's Position,"Son of a respected warrior-chief named Brianos (speculative), who led his clan in early migrations"
415-405 BCE,Fosterage Period,"According to Celtic custom, sent to foster with allied family to learn leadership and warrior skills"
410-400 BCE,First Raids,"Participates in first raids against neighboring tribes, displaying leadership abilities"
405-395 BCE,Marriage Alliance,"Marries daughter of influential Senones chief, strengthening his position within the tribe"
400-395 BCE,Migration Decision,Participates in tribal council decision to migrate across the Alps seeking new lands
395-393 BCE,Journey to Italy,Leads a portion of the Senones tribe across the Alps into the Po Valley of northern Italy
393-392 BCE,Early Italian Settlements,Establishes Senones settlements in what becomes known as Cisalpine Gaul
392-391 BCE,Rise to Tribal Leadership,"Following his father's death or retirement, emerges as chief of the Senones in Italy"
Brennus I: The Roman Conflict (391 BCE - 385 BCE),,
Year,Event,Details
391 BCE,Battle of Clusium,Conflict begins with Etruscan city of Clusium over land and resources
391 BCE,Roman Diplomatic Involvement,Romans send Fabii brothers as ambassadors to mediate the dispute
391 BCE,Diplomatic Incident,Roman ambassadors violate neutrality by joining battle against Gauls
391 BCE,Brennus Demands Justice,Sends messengers to Rome demanding the Fabii be handed over for their violation
390 BCE,Roman Refusal,"Rome refuses to punish the Fabii, instead electing them as military tribunes"
390 BCE,Decision to March on Rome,Brennus gathers war council and decides to punish Rome directly
390 BCE,March to Rome,"Leads approximately 30,000 warriors southward toward Rome"
"July 18, 390 BCE",Battle of the Allia,"Ambushes and crushes Roman army at the Allia River, opening path to Rome"
"July 19-20, 390 BCE",Entry into Rome,Finds Rome largely abandoned except for the Capitoline Hill
July-November 390 BCE,Siege of Capitoline,Besieges last Roman defenders on the Capitoline Hill for several months
November 390 BCE,"""Vae Victis"" Incident","When weighing gold tribute, throws his sword on scales saying ""Woe to the vanquished"""
November 390 BCE,End of the Sack of Rome,"Leaves Rome with plunder, either due to disease, food shortages, or threats to their homeland"
389-387 BCE,Return to Senones Territory,"Distributes plunder, strengthening his position among Celtic tribes in northern Italy"
387-385 BCE,Later Career,Consolidates Senones territory in northeastern Italy
385 BCE,Fate of Brennus I,"Disappears from historical record, possibly died of natural causes or in subsequent conflicts"
Celtic World Between the Two Brennus Leaders (385 BCE - 280 BCE),,
Year,Event,Details
385-370 BCE,Roman Recovery,Romans rebuild their city and begin to develop stronger military organization
370-350 BCE,Italian Gallic Confederacy,Celtic tribes in northern Italy form loose confederations for mutual defense
367 BCE,Licinan-Sextian Laws,Roman military reforms partially in response to Gallic threat
360-340 BCE,Celtic Mercenary Service,Italian Gauls begin serving as mercenaries for various Mediterranean powers
350-330 BCE,La Tène Culture Peak,Celtic art and craftsmanship reaches its peak in homeland territories
340-330 BCE,Alexander's Celtic Encounter,"Alexander the Great meets with Celtic ambassadors who claim to fear only that ""the sky might fall"""
335 BCE,First Balkan Celtic Incursions,Small Celtic groups begin probing the northern Balkans
330-310 BCE,Expansion into Eastern Europe,"Celtic groups expand into what is now Hungary, Romania, and Serbia"
310-300 BCE,Rome vs Etruscans,"Romans engage in wars with Etruscans, sometimes employing Celtic mercenaries"
300-290 BCE,Danubian Celtic Kingdoms,Powerful Celtic kingdoms established along the Danube River
298-290 BCE,Third Samnite War,"Rome secures dominance over central Italy, bringing them closer to Gallic territories"
285-282 BCE,Political Instability in Macedon,"After death of Lysimachus, Macedonian kingdom experiences succession struggles"
281-280 BCE,Celtic Tribal Confederation,Large confederation of Celtic tribes gathers on the northern borders of Greece
Brennus II: Early Life and Rise (Speculative Based on Celtic Customs),,
Year,Event,Details
320-310 BCE,Birth of Brennus II,Born into a powerful clan of the Prausi or Tectosages tribe in Danubian region
315-305 BCE,Childhood in Migrating Tribe,Raised during period of tribal migration and warfare in Eastern Europe
310-300 BCE,Family Background,Son of successful war leader who expanded tribal territory eastward
305-295 BCE,Warrior Training,Undergoes traditional training in Celtic warrior arts
300-290 BCE,First Military Campaigns,Participates in raids against Illyrian and Thracian peoples
295-285 BCE,Rise Within Tribal Hierarchy,Gains reputation through successful raids and personal combat
290-285 BCE,Leadership of War Band,Commands personal war band (comitatus) attracting warriors with success and plunder
285-282 BCE,Tribal Leadership,Becomes chief of his tribe through combination of military success and political alliances
282-281 BCE,Vision of Southern Conquest,"Promotes idea of invasion of Macedonia and Greece, citing their wealth and internal divisions"
281-280 BCE,Formation of Tribal Coalition,Successfully unites various Celtic tribes under his leadership for southern campaign
Brennus II: The Greek Invasion (280 BCE - 279 BCE),,
Year,Event,Details
Early 280 BCE,Initial Balkan Campaign,Leads invasion force of multiple Celtic tribes southward into Thrace
Summer 280 BCE,Battle of Lysimachia,"Celtic forces defeat Macedonian army, kill King Ptolemy Keraunos"
Late 280 BCE,Division of Forces,Some Celtic groups under Cerethrius and Bolgius raid Thrace and Macedonia
Winter 280-279 BCE,Planning Greek Invasion,"Winters in captured territories, gathers intelligence on Greek defenses"
Early 279 BCE,Massive Force Assembly,"Organizes largest Celtic army yet seen in the region (claimed 152,000 infantry by ancient sources)"
Spring 279 BCE,Thessalian Invasion,"Leads forces into Thessaly, defeating local resistance"
June 279 BCE,Greek Coalition Forms,Greek states form defensive alliance against Celtic invasion
Summer 279 BCE,Initial Assault on Thermopylae,First attack on Greek position at Thermopylae is repulsed
August 279 BCE,Bypass Maneuver,Discovers mountain path around Thermopylae (similar to Persian invasion route)
August 279 BCE,Tactical Division,Sends Acichorius with part of army to raid Aetolia as diversion
September 279 BCE,March on Delphi,"Leads approximately 40,000 warriors toward Delphi Oracle and its treasures"
October 279 BCE,Mountain Harassment,Greek forces harass Celtic army with skirmish tactics in mountainous terrain
Late October 279 BCE,Battle of Delphi,Attacks sanctuary of Delphi but faces fierce Greek resistance
Late October 279 BCE,"The ""Divine Intervention""","Massive storm with lightning, rockslides, and earthquake disrupts Celtic attack"
October/November 279 BCE,Defeat and Wounding,Severely wounded during battle at Delphi
November 279 BCE,Brennus' Death,"Wounded in battle and unable to recover, Brennus reportedly takes his own life"
Winter 279-278 BCE,Celtic Retreat,"Surviving forces under Acichorius retreat northward, harassed by Greek forces"
Aftermath and Celtic Legacy (278 BCE - Later Influences),,
Year,Event,Details
278-277 BCE,Invitation to Asia Minor,Nicomedes I of Bithynia invites Celtic mercenaries to cross to Asia Minor
277 BCE,Crossing to Anatolia,"Approximately 20,000 Celtic survivors cross the Hellespont"
277-275 BCE,Service in Bithynia,"Celts serve Nicomedes in his civil war, gaining reputation as fierce warriors"
275 BCE,Battle of Elephants,Seleucid king Antiochus I defeats Galatians using war elephants
274-262 BCE,Galatian Settlement,"Celtic tribes settle in central Anatolia, establishing the region later known as Galatia"
241-240 BCE,Attalid Victory,"Attalus I of Pergamon defeats Galatians, commissioning famous ""Dying Gaul"" sculptures"
225 BCE,Battle of Telamon,"Romans defeat Cisalpine Gauls in Italy, beginning final conquest of Po Valley"
191 BCE,Roman-Galatian Conflict,"Romans under Manlius Vulso invade Galatia, subjugating the region"
64 BCE,Galatia Becomes Client Kingdom,"Pompey reorganizes East, making Galatia a Roman client state"
49-45 BCE,Caesar's Gallic Accounts,"Julius Caesar publishes his ""Gallic Wars,"" shaping Roman view of Celts"
25 BCE,Galatia Becomes Roman Province,Emperor Augustus converts Galatia into a formal Roman province
48-52 CE,Galatian Christianity,St. Paul visits and writes Epistle to the Galatians
92-94 CE,Tacitus's Germania,Roman historian Tacitus records information about Celtic and Germanic peoples
12th Century CE,Geoffrey of Monmouth,Medieval chronicler incorporates Brennus into legendary British history
18th-19th Century CE,Celtic Revival,Romantic nationalist movements revive interest in Celtic heritage
20th Century CE,Archaeological Discoveries,Modern archaeology reveals actual extent and sophistication of Celtic civilization
