Comparative Table of Christian and Dionysian Elements,,,,,,,,,,,,,
Category,Christian Element,Dionysian/Pagan Parallel,Significance,Type,Timeframe/Region,,,,,,,,
Thematic Parallels,"Jesus as ""Son of God""",Dionysus as Zeus's chosen heir,Cosmic heir narrative,Thematic,Pre-dates Christianity by centuries,,,,,,,,
,Virgin birth narrative,"Dionysus born of Persephone/Kore (""virgin"")","Divine birth from a ""virgin"" figure",Thematic,Pre-dates Christianity by centuries,,,,,,,,
,Wine miracles at Cana,Dionysian water-to-wine miracles at festivals,Divine power over nature,Thematic,200+ years before Jesus,,,,,,,,
,Eucharist (bread/wine),Dionysian ritual consumption of grain/grape,Sacred meal for communion with the divine,Thematic,Eleusinian/Dionysian mysteries pre-date,,,,,,,,
,Jesus raising Lazarus,Dionysus raising poet Aeschylus from death,Resurrection motif,Thematic,Predates Gospel accounts,,,,,,,,
,"Early church ""ecclesia"" structure",Athenian/Corinthian Dionysian groups,Democratic religious organization,Thematic,Pre-dates Christian assemblies,,,,,,,,
,Christian persecution by Rome,Bacchic persecution in 186 BCE,Roman suppression of foreign cults,Thematic,~200 years before Christian persecution,,,,,,,,
,"Jesus as ""Logos"" with God","Dionysus/Sabazius ""in bosom of father""",John’s Gospel uses similar cosmic narrative,Thematic,Pre-Christian Bacchic traditions,,,,,,,,
,John the Baptist as forerunner,Cadmus praised as forerunner in Bacchae,Similar narrative structure,Thematic,Euripides’ Bacchae (5th c. BCE),,,,,,,,
,Crowd scenes in Gospel of John,Chorus of satyrs/maenads in Bacchae,Dramatic structure parallels,Thematic,Euripides’ Bacchae,,,,,,,,
,Pharisees opposing Jesus,Pentheus opposing Dionysus,Religious authorities as antagonists,Thematic,Euripides’ Bacchae,,,,,,,,
,Pilate finding no fault in Jesus,Pentheus' assistants finding no fault in Dionysus,Similar trial narrative,Thematic,Euripides’ Bacchae,,,,,,,,
,January 6th Epiphany,January 5-6th Dionysian wine miracle,Calendar alignment of divine manifestation,Thematic,Shared festival timing,,,,,,,,
,"Christ as ""Lamb of God""","Dionysus as ""Bull of God"" or ""Horn Child of Ammon""",Sacrificial divine animals,Thematic,Pre-Christian symbolism,,,,,,,,
,Blood of Christ in Eucharist,Bull's blood in taurobolium mysteries,Sacrificial blood symbolism,Thematic,Mystery cult practices,,,,,,,,
,"Christ's ""real flesh and blood"" (John 6)",Dionysus as grapes/wine to be consumed,Divine substance consumption for salvation,Thematic,Mystery cult theology,,,,,,,,
,Jesus with disciples at Last Supper,"Ion with ""three disciples"" in 2nd c. art",Iconographic parallels,Thematic,2nd century CE art,,,,,,,,
,Jesus as divine child in cave,Ion/Mithra as divine child in cave,Birth narrative/iconography similarity,Thematic,Pre-Christian iconography,,,,,,,,
,"Virgin Mary as ""Mother of God""","Cybele as ""Mother of God"" for Sabazius",Divine mother veneration,Thematic,Anatolian religious traditions,,,,,,,,
,Horse-riding hero in Revelation,Mithra/Sabazius/Zalmoxis as horse-riding hero,Apocalyptic iconography,Thematic,Syncretic religious imagery,,,,,,,,
,St. George slaying dragon,Mithra/Sabazius slaying serpent,Direct iconographic transfer,Thematic,Late antique religious art,,,,,,,,
Linguistic/Conceptual,"""Logos"" (Word of God)",Title of Zeus/Kronus passed to Dionysus,Divine mediator concept,Terminology,Hellenistic theology,,,,,,,,
,"""In the bosom of the Father"" (John 1:18)",Sabazius in thigh/bosom of Zeus,Divine relationship imagery,Terminology,Mystery cult terminology,,,,,,,,
,"""Virgin"" (Mary)","""Kore"" (title of Persephone, mother of Dionysus)",Divine mother terminology,Terminology,Greek religious titles,,,,,,,,
,"""Epiphany"" (manifestation of Christ)","""Theophania"" (manifestation of Dionysus)",Same festival date (Jan 6) and concept,Terminology,Shared religious calendar,,,,,,,,
,"""Orpheus"" (name used for Christ)",Original Orphic priest of Dionysus,Direct theological borrowing acknowledged by early Church,Terminology,Early Christian syncretism,,,,,,,,
,"""Iao"" (ancient form of YHWH)",Title applied to Dionysus in chants,Syncretic identification of deities,Terminology,Magical/religious syncretism,,,,,,,,
,"""Eucharist"" (good grace)","""Kykeon"" (mixed drink in Eleusinian Mysteries)",Ritual consumption for salvation,Terminology,Mystery cult practices,,,,,,,,
,"""Theos Hypsistos"" (God Most High)",Title for Zeus Sabazios,Shared theological term,Terminology,Hellenistic Jewish/Greek overlap,,,,,,,,
,"""Benedictio Latina"" hand gesture",Hand of Sabazius gesture,Direct iconographic borrowing,Terminology,Religious symbolism,,,,,,,,
Geographic Links,Asia Minor (Turkey),Core region for Dionysian cults & early Christianity,Syncretic development,Region,1st–4th c. CE,,,,,,,,
,Phrygia & Cappadocia,Center of Sabazius/Cybele worship,Later important Christian centers,Region,Pre-Christian era,,,,,,,,
,Seven Churches of Asia (Revelation),Regions where Dionysian/Mithraic cults thrived,Religious competition/syncretism,Region,1st–3rd c. CE,,,,,,,,
,Thrace,Origin of Zalmoxis worship,Early Christian development,Region,Pre-Christian era,,,,,,,,
,Alexandria,Center of Greek-Jewish-Christian syncretism,Theological cross-pollination,Region,Hellenistic-Roman period,,,,,,,,
,Antioch,Hub of pagan syncretism & early Christianity,Early Christian community formation,Region,1st–4th c. CE,,,,,,,,
,,,,,,,,,,,,,
,,,,,,,,,,,,,
,,,,,,,,,,,,,
"Here is an expanded comparative table synthesizing the Christian and Dionysian elements alongside parallels from Mithras, Mitra, Maitreya, Gaumata Bardiya, Gautama the Buddha, Thracian Rider, Apollo, Hermes, and others. The table is structured for clarity, showing thematic, ritual, and iconographic similarities as well as regional and linguistic overlaps. Where direct parallels exist, they are noted; where traditions differ or data is sparse, this is indicated.",,,,,,,,,,,,,
,,,,,,,,,,,,,
Category,Christian Element,Dionysian/Pagan Parallel,Mithras,Mitra (Vedic),Maitreya,Gaumata Bardiya,Gautama Buddha,Thracian Rider,Apollo,Hermes,Significance,Type,Timeframe/Region
Thematic Parallels,"Jesus as ""Son of God""",Dionysus as Zeus's chosen heir,"Mithras as divine mediator, son of Ahura Mazda","Mitra as divine son, mediator","Awaited ""Son of Man""",Claimed divine sonship,"Buddha as ""son"" of prophecy",Rider as divine hero,Apollo as son of Zeus,Hermes as son of Zeus,Cosmic heir narrative,Thematic,Pre-dates Christianity by centuries
Virgin birth narrative,Jesus born of Mary,"Dionysus born of Persephone/Kore (""virgin"")",Mithras born from rock (virgin birth motif),Mitra born from cosmic egg,Maitreya to be born miraculously,No virgin birth,Buddha born from Queen Maya’s side,Rider: no virgin motif,Apollo: Leto’s miraculous birth,Hermes: Maia’s miraculous birth,"Divine birth from ""virgin"" figure",Thematic,Pre-dates Christianity by centuries
Wine miracles at Cana,Dionysian water-to-wine miracles,"No direct parallel, but ritual drink (haoma)",Soma/haoma rituals,"Not wine, but future paradise",No wine motif,No wine motif,No wine motif,Apollo: no wine miracles,Hermes: no wine miracles,Divine power over nature,Thematic,200+ years before Jesus16,
Eucharist (bread/wine),"Sacred meal, bread/wine",Dionysian ritual consumption of grain/grape,Mithraic sacred meal (bread/wine),Soma/haoma shared in ritual,Not present,Not present,Not present,Not present,Not present,Not present,Sacred meal for communion,Thematic,Eleusinian/Dionysian mysteries pre-date
Resurrection motif,Jesus raising Lazarus,Dionysus raising Aeschylus,"Mithras slaying bull, life from death",Mitra as preserver,Maitreya as future resurrector,No resurrection motif,Buddha’s enlightenment (spiritual rebirth),Rider as reborn hero,Apollo: no resurrection,Hermes: psychopomp (guide of souls),Resurrection/salvation motif,Thematic,Predates Gospel accounts6
"Early church ""ecclesia""",Christian assemblies,Dionysian thiasoi (religious groups),Mithraic brotherhoods,Vedic sangha,Buddhist sangha,No parallel,Buddhist sangha,Thracian cult groups,Apollo: temples,Hermes: cults,Democratic religious organization,Thematic,Pre-dates Christian assemblies
Persecution by Rome,Christian persecution,Bacchic persecution (186 BCE),Mithraic cults suppressed,No direct parallel,Buddhist persecution in India,No parallel,Buddhist persecution,Rider: no direct parallel,Apollo: no direct parallel,Hermes: no direct parallel,Roman suppression of cults,Thematic,~200 years before Christian persecution
"""Logos"" (Word of God)",Jesus as Logos,Dionysus/Sabazius as divine mediator,Mithras as mediator,Mitra as mediator,Maitreya as teacher,No parallel,Buddha as Dharma teacher,Rider: no direct parallel,Apollo: god of prophecy (word),Hermes: messenger god (logos),Divine mediator concept,Terminology,Hellenistic theology10
"""Epiphany"" (manifestation)",Manifestation of Christ (Jan 6),Dionysian Theophania (Jan 6),Mithraic festival dates,Mitra: solar festivals,Maitreya: future manifestation,No parallel,Buddha’s enlightenment day,Rider: festival days,Apollo: festival days,Hermes: festival days,Calendar alignment of divine manifestation,Terminology,Shared religious calendar6
"""Lamb of God""",Christ as sacrificial lamb,"Dionysus as ""Bull of God""",Mithras slays bull (tauroctony),No direct parallel,No direct parallel,No parallel,No parallel,Rider: horse sacrifice,Apollo: no direct parallel,Hermes: no direct parallel,Sacrificial divine animals,Thematic,Pre-Christian symbolism
Blood symbolism,Blood of Christ in Eucharist,Bull’s blood in taurobolium,Bull’s blood in Mithraic rites,"Soma/haoma as ""divine blood""",No parallel,No parallel,No parallel,Rider: horse/blood sacrifice,Apollo: no direct parallel,Hermes: no direct parallel,Sacrificial blood symbolism,Thematic,Mystery cult practices10
Divine child in cave,Jesus as child in cave,Ion/Mithra as child in cave,Mithras born in cave,Mitra: no cave birth,Maitreya: not in cave,No parallel,Buddha: not in cave,Rider: depicted in cave-like shrines,Apollo: cave birth,Hermes: cave birth,Birth narrative/iconography,Thematic,Pre-Christian iconography
Divine mother,"Virgin Mary as ""Mother of God""","Cybele as ""Mother of God"" for Sabazius",Anahita as divine mother,Aditi as mother of Mitra,Maitreya’s mother prophesied,No parallel,Queen Maya as Buddha’s mother,Rider: no direct parallel,Leto as mother of Apollo,Maia as mother of Hermes,Divine mother veneration,Thematic,Anatolian religious traditions
Horse-riding hero,Revelation’s horseman,Mithra/Sabazius/Zalmoxis as horse-rider,Mithras as horseman,Mitra: solar chariot,Maitreya: not depicted,No parallel,Buddha: not depicted,Rider: central motif,Apollo: chariot of sun,Hermes: not depicted,Apocalyptic/heroic iconography,Thematic,Syncretic religious imagery
St. George slaying dragon,No direct parallel,Mithra/Sabazius slaying serpent,Mithras slaying bull/serpent,No parallel,No parallel,No parallel,Buddha: no parallel,Rider: slaying beast,Apollo: slaying Python,Hermes: no parallel,Iconographic transfer,Thematic,Late antique religious art
Geographic Links,"Asia Minor (Turkey), Phrygia, Cappadocia, Thrace, Alexandria, Antioch","Core Dionysian, Sabazius, Mithraic, and Orphic regions","Mithraic cults in Asia Minor, Rome","Mitra: Iran, India","Maitreya: India, Central Asia",Gaumata: Persia,"Buddha: India, Central Asia","Rider: Thrace, Balkans","Apollo: Greece, Anatolia","Hermes: Greece, Anatolia",Syncretic development,Region,1st–4th c. CE
,,,,,,,,,,,,,
Key Notes:,,,,,,,,,,,,,
,,,,,,,,,,,,,
"Many motifs (divine birth, sacred meal, resurrection, cosmic mediator) have parallels across mystery religions and regional cults, often predating Christianity by centuries610.",,,,,,,,,,,,,
,,,,,,,,,,,,,
"Mithras and Dionysus share the most ritual and iconographic overlap with early Christianity, especially in sacred meal, blood symbolism, and cave birth motifs.",,,,,,,,,,,,,
,,,,,,,,,,,,,
Vedic Mitra and Buddhist Maitreya/Buddha share some conceptual but fewer direct ritual parallels.,,,,,,,,,,,,,
,,,,,,,,,,,,,
"The Thracian Rider, Apollo, and Hermes echo some iconographic and thematic elements, especially in hero and messenger motifs.",,,,,,,,,,,,,
,,,,,,,,,,,,,
"Geographic overlap in Asia Minor, Thrace, and Hellenistic centers facilitated syncretism and the blending of religious traditions.",,,,,,,,,,,,,
,,,,,,,,,,,,,
This table provides a comparative framework for analyzing how Christian narratives and rituals intersected with and were influenced by a wide range of ancient Mediterranean and Near Eastern traditions. Let me know if you want further detail on any specific figure or motif.,,,,,,,,,,,,,
Citations:,,,,,,,,,,,,,
https://mythologymatters.wordpress.com/2020/02/24/the-mythology-of-wine-vii-the-wine-miracles-of-dionysus-and-jesus-compared/,,,,,,,,,,,,,
https://biblepulze.com/fascinating-connection-between-jesus-and-dionysus/,,,,,,,,,,,,,
https://www.reddit.com/r/dionysus/comments/n4a2rg/is_there_a_theory_that_dionysus_was_jesus/,,,,,,,,,,,,,
https://www.touchstonemag.com/archives/article.php?id=36-02-024-f&readcode=&readtherest=true,,,,,,,,,,,,,
https://vridar.org/2013/04/29/jesus-and-dionysus-the-gospel-of-john-and-euripides-bacchae/,,,,,,,,,,,,,
https://www.shortform.com/blog/dionysus-jesus/,,,,,,,,,,,,,
https://whyevolutionistrue.com/2014/10/03/once-again-was-there-a-historical-jesus/,,,,,,,,,,,,,
https://journals.sagepub.com/doi/abs/10.1177/0146107921997108,,,,,,,,,,,,,
https://biblebasedliving.com/jesus-dionysus/,,,,,,,,,,,,,
https://thebibleisnotholy.wordpress.com/wp-content/uploads/2010/06/among-the-gentiles-greco-roman-religion-and-christianity-2009.pdf,,,,,,,,,,,,,
https://eprints.whiterose.ac.uk/96065/1/Print%20Proofs%20Flesh%20Final.pdf,,,,,,,,,,,,,
,,,,,,,,,,,,,
Answer from Perplexity: pplx.ai/share,,,,,,,,,,,,,
