Vision Reference,Book/Source,Est. Date (BCE/CE),Recipient/Prophet,Vision Sequence/Theme,Key Symbolism/Themes,,,
Genesis 28:12-15,Genesis,c. 10th–5th BCE,Jacob,Ladder to heaven; angels ascending/descending; God at the top,"Divine-human connection, reaffirmation of Abrahamic covenant, God's ongoing presence and promise68",,,
Exodus 24:9-11,Exodus,c. 10th–5th BCE,"Moses, Aaron, elders",Vision of God on Mount Sinai; eating and drinking in God's presence,"Theophany, covenant ratification, divine holiness",,,
Exodus 33:18-23,Exodus,c. 10th–5th BCE,Moses,Moses asks to see God's glory; sees God's back but not face,"God's transcendence, mediated revelation",,,
2 Chronicles 18:18,Chronicles,c. 5th–4th BCE,Micaiah,"Vision of the Lord on His throne, heavenly council, lying spirit","Divine sovereignty, prophetic authority, heavenly deliberation",,,
Isaiah 6:1-8,Isaiah,c. 8th BCE,Isaiah,"The Lord enthroned, seraphim, temple filled with smoke, Isaiah's commission","Divine majesty, purification, prophetic calling15",,,
Jeremiah 1:11-14,Jeremiah,c. 7th–6th BCE,Jeremiah,"Almond branch (watchfulness), boiling pot (impending disaster from the north)","Imminence of judgment, God's vigilance",,,
"Ezekiel 1, 8, 10, 37, 40–48",Ezekiel,c. 6th BCE,Ezekiel,"Multiple: throne vision (cherubim, wheels), abominations in temple, valley of dry bones, new temple","God's glory, judgment, restoration, eschatological hope245",,,
"Daniel 2, 7, 8, 10–12",Daniel,c. 6th–2nd BCE,Daniel (and Nebuchadnezzar),"Statue dream, four beasts, ram and goat, angelic revelations, end times","Gentile kingdoms, divine judgment, messianic kingdom, apocalyptic imagery45",,,
Zechariah 1–6,Zechariah,c. 6th BCE,Zechariah,"Eight night visions: horses, horns, measuring line, high priest, lampstand, flying scroll, woman in basket, four chariots","Restoration, spiritual cleansing, judgment, messianic hope, cosmic sovereignty357",,,
Matthew 17:1-9,Matthew,c. 1st CE,"Peter, James, John","Transfiguration: Jesus in glory, Moses & Elijah appear, divine voice","Christ's divinity, fulfillment of Law and Prophets, divine sonship",,,
Acts 7:55-56,Acts,c. 1st CE,Stephen,Sees Jesus standing at the right hand of God as he is martyred,"Christ's exaltation, heavenly vindication",,,
Acts 9:3-6,Acts,c. 1st CE,Saul/Paul,"Blinding light, vision of Jesus, conversion","Divine intervention, apostolic calling",,,
Acts 10:9-16,Acts,c. 1st CE,Peter,"Sheet with unclean animals, divine command to eat","Inclusion of Gentiles, abrogation of ritual barriers",,,
2 Corinthians 12:2-4,2 Corinthians,c. 1st CE,Paul,"Caught up to the third heaven, hears inexpressible things","Mystical experience, ineffability of divine revelation",,,
"Revelation 1, 4–5, 6–22",Revelation,c. 1st CE,John of Patmos,"Series of apocalyptic visions: Christ among lampstands, throne room, seals, trumpets, beasts, New Jerusalem","Eschatological judgment, cosmic conflict, ultimate restoration, symbolic imagery5",,,
,,,,,,,,
"major biblical and early Jewish references to heavenly ascent, chariot (merkabah), wheels, and related motifs—including the four winds, four beasts, four wings, four angels (chariot bearers), and connections to Merkabah/Hekhalot literature. Key symbolic and visionary elements are included for each entry.",,,,,,,,
Reference/Source,Date (BCE/CE),Visionary/Recipient,Chariot/Wheel Motif,Four Winds,Four Beasts,Four Wings,Four Angels/Chariot Bearers,Related Merkabah/Hekhalot Themes/Symbolism
"Ezekiel 1, 10",c. 6th BCE,Ezekiel,"Divine chariot (merkabah), wheels within wheels, throne above firmament",Implied (spirit/wind moves chariot),"Four living creatures (cherubim, each with four faces)",Each creature has four wings,Four living creatures (cherubim),"Foundational merkabah vision: heavenly throne, chariot, angelic hosts, mystical ascent234579"
Daniel 7,c. 6th–2nd BCE,Daniel,Throne with wheels (Dan 7:9),Four winds stir the sea (Dan 7:2),Four beasts emerge from the sea,Leopard beast has four wings,"Not explicit, but four beasts as cosmic powers",Apocalyptic vision; connects with Ezekiel’s imagery; cosmic judgment681112
Zechariah 6:1–8,c. 6th BCE,Zechariah,Four chariots between two mountains,Four spirits/winds of heaven (Zech 6:5),Not explicit,Not explicit,Four chariot-driving angels,Angelic chariot bearers; four winds as cosmic agents; apocalyptic and merkabah themes
2 Kings 2:11,c. 7th–6th BCE,Elijah,"Chariot of fire, horses of fire, whirlwind ascent",Whirlwind (implied wind),No,No,No,Prototype of heavenly ascent; basis for later merkabah mysticism1
Revelation 4–7,c. 1st CE,John of Patmos,Throne with four living creatures around it,Four angels hold back four winds (Rev 7:1),Four living creatures,Each has six wings (but four creatures),Four angels (Rev 7:1),"Combines Ezekiel’s living creatures, Daniel’s beasts, and apocalyptic winds; key source for Hekhalot literature10"
Psalm 104:3,c. 10th–5th BCE,Psalmist,"God makes clouds His chariot, walks on wings of the wind",Wings of the wind,No,No,No,Poetic precursor to chariot/wind motifs in later visions1
Psalm 68:17,c. 10th–5th BCE,Psalmist,Chariots of God are myriads,No,No,No,No,Multitude of divine chariots; heavenly host imagery1
Jeremiah 49:36,c. 7th–6th BCE,Jeremiah,"No chariot, but wind motif",Four winds of heaven to scatter Elam,No,No,No,Four winds as agents of divine judgment; motif reappears in apocalyptic and merkabah literature1012
"Hekhalot Rabbati, Hekhalot Zutarti, 3 Enoch",c. 3rd–7th CE,Early Jewish mystics,"Detailed descriptions of merkabah, chariot, angelic throne bearers",Four winds sometimes referenced,"Angelic beasts, living creatures",Angelic beings with multiple wings,"Angelic chariot bearers (Ophanim, Hayyot, Seraphim)","Expansion of Ezekiel’s vision; mystical ascent, angelic hierarchies, heavenly palaces (hekhalot), throne mysticism"
,,,,,,,,
Key Observations and Connections,,,,,,,,
,,,,,,,,
"Ezekiel’s Vision is the archetype: Four living creatures (cherubim) each with four faces and four wings, supporting the divine chariot with wheels within wheels. The spirit/wind moves the chariot, and the vision is foundational for later merkabah (chariot) mysticism234579.",,,,,,,,
,,,,,,,,
"Daniel 7 links the four winds, four beasts, and a throne with wheels, blending motifs of cosmic chaos, judgment, and divine sovereignty. The four beasts (lion, bear, leopard with four wings and four heads, and a terrifying beast) represent empires and cosmic powers681112.",,,,,,,,
,,,,,,,,
"Zechariah 6 explicitly connects four chariots with the four winds/spirits of heaven, each chariot driven by an angelic figure, furthering the apocalyptic and merkabah tradition.",,,,,,,,
,,,,,,,,
"Revelation 4–7 synthesizes Ezekiel and Daniel: Four living creatures surround the throne, four angels hold back the four winds, and apocalyptic judgment unfolds. These motifs are central in later Hekhalot literature10.",,,,,,,,
,,,,,,,,
"Merkabah/Hekhalot Literature (e.g., 3 Enoch, Hekhalot Rabbati) elaborates on Ezekiel’s vision, describing mystical ascents, angelic chariot bearers (Ophanim, Hayyot), and the heavenly palaces, with frequent references to the four winds and cosmic guardians.",,,,,,,,
,,,,,,,,
Summary Table of Motifs,,,,,,,,
,,,,,,,,
Motif,Ezekiel 1/10,Daniel 7,Zechariah 6,Revelation 4–7,Hekhalot Literature,,,
Chariot/Wheels,Yes,Yes,Yes,Implied,Yes,,,
Four Winds,Implied,Yes,Yes,Yes,Sometimes,,,
Four Beasts,Yes,Yes,No,Yes,Yes,,,
Four Wings,Yes,Yes (leopard),No,Yes (per creature),Yes,,,
Four Angels/Bearers,Yes,No,Yes,Yes,Yes,,,
,,,,,,,,
"This synthesis demonstrates the continuity and development of these motifs from biblical visions into the mystical traditions of late antiquity, where they became central to Jewish merkabah and hekhalot literature.",,,,,,,,
Share,,,,,,,,
Export,,,,,,,,
Rewrite,,,,,,,,
