Chronological Analysis of Hero-Twin Narratives in World Mythology,,,,,,,
Twin/Brother Narratives Across Time and Cultures,,,,,,,
Approx. Date,Tradition,Narrative,Key Brothers/Twins,Conflict/Relationship,Resolution/Function,Cultural Significance,Distinctive Elements
5000-4000 BCE,Proto-Indo-European,Divine Twins,Yemo and Manu,Sacrifice of Yemo by Manu,Creation of world and humans,Origin of cosmic order and death,"First sacrifice, world creation from body"
3500-3000 BCE,Mesopotamian,Enki and Enlil,Divine half-brothers,Division of cosmic realms,"Enlil (air/earth), Enki (water/wisdom)",Establishment of natural order,"Complementary powers, later rivalry"
3200-3000 BCE,Egyptian,Horus and Set,Nephew vs uncle (functional brothers),Throne succession,"Combat, divine tribunal, Horus victorious",Eternal cycle of order vs chaos,"Eye of Horus, dismemberment motif"
3000-2500 BCE,Egyptian,Osiris and Set,Brothers,"Throne succession, jealousy","Murder, dismemberment, resurrection",Death and resurrection cycle,"Agricultural fertility, divine judgment"
2700-2500 BCE,Mesopotamian,Gilgamesh and Enkidu,King and wild man (symbolic brotherhood),Initial combat,Deep friendship until death,Civilization vs wilderness,"Urban/wild dichotomy, quest for immortality"
2000-1700 BCE,Vedic,Indra and Vritra,Divine vs demonic (symbolic siblings),Cosmic waters,Indra slays Vritra,Liberation of cosmic waters,Thunder weapon motif (PIE pattern)
2000-1500 BCE,Vedic,Mitra-Varuna,Divine pair,Complementary powers,"Mitra (contracts/day), Varuna (cosmic order/night)",Social vs cosmic law,Bipartite sovereignty function
1900-1700 BCE,Biblical,Cain and Abel,First brothers,"Divine favor, offering","Murder, exile","Origin of murder, division",Agricultural vs pastoral tension
1800-1700 BCE,Biblical,Jacob and Esau,Twins,"Birthright, blessing","Deception, exile, reconciliation",Israel and Edom origins,"Heel-grabbing, wrestling divine"
1700-1400 BCE,Hittite,Storm God and Illuyanka,Divine vs serpent,Control of waters,"Initial defeat, later victory",Seasonal renewal,Dragon-slaying motif (PIE)
1500-1200 BCE,Greek,Prometheus and Epimetheus,Titan brothers,Knowledge and fire,"Punishment, human creation",Human capability and limits,Forethought vs afterthought
1300-1000 BCE,Greek,"Zeus, Poseidon, Hades",Divine brothers,Cosmic rulership,Division by lots,Cosmic order,Triple division (PIE pattern)
1250-1100 BCE,Greek,Castor and Pollux (Dioscuri),"One mortal, one divine twin",Shared immortality,Alternating afterlife,Divine intervention,"Patron of sailors, horsemen"
1200-800 BCE,Germanic,Mannus and brothers,Three sons of Tuisto,Division of peoples,Formation of Germanic tribes,Tribal origins,Tripartite social division (PIE)
1000-800 BCE,Hebrew,Moses and Aaron,Brothers,Leadership roles,Complementary functions,Religious and political authority,Prophet/priest dichotomy
800-700 BCE,Greek,Apollo and Artemis,Divine twins,Complementary domains,"Sun/moon, music/hunting",Balance of masculine/feminine,"Twin archers, civilization/wilderness"
800-600 BCE,Norse,Freyr and Freyja,Divine twins,Fertility powers,Agricultural abundance,Prosperity and fertility,Gender complementary twins
753 BCE,Roman,Romulus and Remus,Twins raised by wolf,City founding location,Romulus kills Remus,Foundation of Rome,"Wolf nurturing, boundary violation"
700-500 BCE,Norse,Thor and Loki,Blood brothers,Order vs trickery,Bound until Ragnarök,Tension in cosmic order,Blood brotherhood without kinship
600-400 BCE,Celtic,Bran and Efnisien,Half-brothers,Marriage alliance,War and sacrifice,Britain/Ireland relations,"Self-sacrifice, magical cauldron"
600-400 BCE,Zoroastrian,Ahura Mazda and Angra Mainyu,Twin spirits,Good vs evil,Ongoing cosmic struggle,Moral dualism,Perfect cosmic opposition
500-300 BCE,Celtic,Lugus and Cernunnos,Functional divine pair,Light vs wild,Seasonal alternation,Civilization and nature cycle,"Triple-faced god, antlered god"
300-100 BCE,Maya,Hunahpu and Xbalanque,Hero twins,Defeat lords of death,"Trickery, sacrifice, rebirth","Cosmic order, maize cycle","Ball game symbolism, resurrection"
200 BCE-100 CE,Roman/Persian,Sol and Mithras,Solar deities,Master and initiate,Cosmic bull slaying,"Mystery cult, salvation","Tauroctony, cave symbolism"
1st century CE,Biblical,Jesus and Thomas (Didymus),Spiritual twins,Doubt vs faith,Thomas's confession,Faith without seeing,"""Twin"" meaning of Thomas/Didymus"
1st century CE,Christian Gnostic,Jesus and Thomas,Spiritual twins,Secret knowledge,Thomas as recipient of secret teachings,Salvation through gnosis,"""Secret sayings"" tradition"
300-600 CE,Mayan,Hero Twins,Hunahpu and Xbalanque,Vengeance for father,Defeat Lords of Xibalba,Creation of present world order,"Ball game symbolism, resurrection"
500-900 CE,Aztec,Quetzalcoatl and Tezcatlipoca,Divine brothers/rivals,Creation and destruction,Cyclical combat,World ages,Mirror/smoking god vs feathered serpent
700-1000 CE,Polynesian,Māui and brothers,Trickster vs siblings,"Jealousy, trickery","Various adventures, fishing lands","Island creation, fire origin","Sun snaring, fishing up islands"
1000-1500 CE,Navajo,Monster Slayer and Born for Water,Hero twins,Monster invasion,Victory through preparation,Restoration of harmony,"Weapons from father, purification"
1400-1500 CE,Iroquois,Ioskeha and Tawiscara,Good and evil twins,Birth contest,Ongoing cosmic struggle,Good/evil in nature,Light vs dark cosmic forces
Theoretical Frameworks for Twin/Brother Narratives,,,,,,,
Theoretical Approach,Key Insight,Primary Examples,,,,,
Structuralist,Binary oppositions reveal cultural categories,"Mitra-Varuna (contract/cosmic), Romulus-Remus (inside/outside)",,,,,
Dumézilian,Reflects tripartite Indo-European social structure,"Mannus's three sons, Zeus-Poseidon-Hades",,,,,
Astronomical,Twins represent celestial bodies/phenomena,"Dioscuri (morning/evening star), Apollo-Artemis (sun/moon)",,,,,
Psychoanalytic,Expresses psychological splitting and integration,"Cain-Abel (destructive/creative), Thor-Loki (ego/shadow)",,,,,
Functionalist,Establishes social boundaries and taboos,"Romulus-Remus (city boundary), Cain-Abel (violence taboo)",,,,,
Ritualistic,Connected to seasonal or initiation ceremonies,"Sol-Mithras (initiation mystery), Osiris-Set (agricultural cycle)",,,,,
Evolution of Divine Twins Concept,,,,,,,
,,,,,,,
PIE Foundation (5000-2000 BCE):,,,,,,,
,,,,,,,
Divine Twins motif (companions on horseback),,,,,,,
"Shared characteristics: youth, horses, rescue, dawn/sun associations",,,,,,,
"Examples: Proto-Mitra-Varuna, precursors to Dioscuri",,,,,,,
,,,,,,,
Sovereign Function Split (2000-1000 BCE):,,,,,,,
,,,,,,,
"Mitra-Varuna partnership (contract/magic, day/night)",,,,,,,
"Developed in Vedic, Avestan, Greek, and Roman traditions",,,,,,,
Bipartite sovereignty function,,,,,,,
,,,,,,,
Solar Associations (1000 BCE-200 CE):,,,,,,,
,,,,,,,
Development of solar theology,,,,,,,
Sol-Mithras relationship in Roman Mithraism,,,,,,,
Morning and evening manifestations,,,,,,,
,,,,,,,
Mystery Traditions (200 BCE-400 CE):,,,,,,,
,,,,,,,
Twins in initiation contexts,,,,,,,
"Mithras mysteries, Dioscuri cults",,,,,,,
Thomas-Jesus in Gnostic traditions,,,,,,,
