Numeric Year,Location/Culture,Headdress/Head Feature Description & Material,Use/Context,Notable Wearers/Depictions,Analysis/Notes
1200–700 BC,Phrygia (Anatolia),"Soft, brimless, forward-bent conical cap (Phrygian cap); wool, felt, or leather","Everyday, ritual, royal","Phrygian elites, King Midas, Attis","The archetypal Phrygian cap, a regional identifier, appears in both daily life and religious imagery. Its pointed, forward-bent form becomes a symbol of Phrygian identity and is later associated with Attis, whose iconography sometimes blends with that of the cap-wearing priests of Cybele."
800–500 BC,"Scythians, Sakas (Eurasian Steppe)","Tall, pointed, sometimes forward-bent felt or leather caps, often richly decorated (bashlyk, Scythian cap)","Warrior, aristocratic, ritual","Scythian/Saka chiefs, warriors","Steppe nomads wore similar conical hats for protection and status. Greek art depicts Scythians and Amazons with these hats, marking them as ""barbarian"" and non-Greek."
700–500 BC,"Thrace, Dacia","Soft, forward-bent conical cap, sometimes with ear flaps","Everyday, religious, mythic depictions","Orpheus, Bendis, Thracian warriors","Thracian and Dacian peoples adopted similar hats, often seen in Greek art and associated with mythic figures. The cap signaled ""otherness"" in classical iconography."
700–400 BC,"Persia, Media","Tall, rounded or pointed cap, sometimes forward-bent; felt, leather, or cloth (Median tiara, Magian mitre)","Courtly, military, priestly","Persian/Median nobility, Magi","Persian and Median elites and priests (Magi) wore ""Phrygian-style"" caps as part of official and ritual dress. The Magian mitre likely influenced later religious headdresses."
500–300 BC,"Greek World (depictions of ""barbarians"")","Soft, forward-bent conical caps in art, sometimes with ear flaps",Iconographic; to mark non-Greek ethnicity,"Paris of Troy, Ganymede, Amazons","Greek vase painting uses the Phrygian cap to signal foreignness, especially for Trojans, Amazons, and Anatolians. The cap distinguishes them from Greeks."
400–100 BC,"Phrygia, Anatolia","Soft, forward-bent cap, sometimes brightly colored; wool or felt","Religious, mythic iconography","Attis, Cybele's priests (Galli)","The Phrygian cap becomes a key attribute of Attis and Cybele’s priests, symbolizing devotion and otherness. This persists in Hellenistic art."
200 BC–200 CE,"Roman Empire (Eastern Provinces, Commagene)","Soft, forward-bent cap, sometimes with embroidery or jewels","Royal, priestly, mythic iconography","Kings of Commagene, Eros (Tanagra)","The cap appears in statuary and reliefs, signaling eastern or non-Roman origins. In some cases, it is associated with exoticism or priesthood."
100–400 CE,Mithraic Cult (Roman Empire),"Soft, forward-bent cap, usually red or bright; wool or felt","Ritual, iconographic (initiation, sacrifice)","Mithras, Mithraic initiates","Mithras is universally depicted with a Phrygian cap, marking him as an eastern, mysterious deity. The cap is worn during the tauroctony (bull-slaying) scene and by initiates, reinforcing its outsider and initiatory symbolism."
100–300 CE,"Gandhara (Kushan Empire, NW India/Pakistan)","Buddha depicted with a chignon or topknot (ushnisha), often voluminous and wavy; schist or stucco","Religious, iconographic",Buddha (Gandhara statues),"Gandhara art introduces the anthropomorphic Buddha, inspired by Greco-Roman models. The ushnisha appears as a hair-knot or chignon, resembling a crown or turban, reflecting Greek influence. Early ushnisha is not a cranial bump but a stylized hair-knot, paralleling the mitre/Phrygian cap as a symbol of elevated/spiritual status1356789."
200–400 CE,Mathura (India),"Buddha and bodhisattvas with topknot (ushnisha), evolving into a more schematic, cranial protuberance","Religious, iconographic",Buddha (Mathura statues),"Mathura style evolves the ushnisha from a hair-knot to a more abstract cranial bump, distinguishing it from Gandharan naturalism. This marks a shift toward more symbolic and less Greco-Roman-influenced Buddhist imagery1689."
600–1400 CE,Tibetan Buddhism,"Tall, pointed or conical hats (red/yellow hats, pandita hats); felt, brocade, silk","Monastic, ritual, ceremonial","Tibetan lamas, monks","Tibetan ritual hats (pandita, lotus, red/yellow hats) share a conical or pointed form, sometimes with forward tilt, echoing ancient Eurasian styles. These hats denote rank, lineage, or ritual function, reflecting diffusion of steppe and Central Asian headgear traditions."
1700–1800 CE,Europe (Revolutionaries),"Soft, red, forward-bent cap (Phrygian/Liberty cap); wool or felt","Symbol of liberty, revolution","French revolutionaries, American patriots","The Phrygian cap is revived as a symbol of freedom and revolution, inspired by classical imagery. It appears in art, iconography, and on national personifications (e.g., Marianne), as well as in ceremonial and popular dress."
Modern Era,"Caucasus (Ingush, etc.)","Kurkhars: soft, forward-bent cap; felt, cloth, embroidery",National female headdress,Ingush women,"The kurkhars, a traditional female headdress in the North Caucasus, preserves the Phrygian cap form into the present, often richly decorated and worn for ceremonial occasions."
Entity/Concept,Date,Tradition,Context,Description,Source
Ushnisha Vijaya Dharani,c. 5th century BCE,Buddhist,Sutra taught by the Buddha,"A sacred Buddhist text (Dharani) recited to overcome suffering and purify karma. While not a ""talking head,"" the ushnisha (cranial protuberance) symbolizes enlightenment and is central to the ritual.",Ushnisha Vijaya Dharani (Buddha Weekly)
Head of John the Baptist,c. 4th century CE,Christian Apocrypha,Apocryphal text (likely Syriac),"The severed head of John the Baptist flies and speaks for three years, condemning Herod’s marriage. A miraculous, vengeful relic in non-canonical tradition.",The Flying Head of John the Baptist (Apocryphicity)
Socrates’ Daimonion,470–399 BCE,Greek Philosophy,Philosophical/theological debate,"Socrates’ ""divine sign,"" an inner voice (daimonion) warning against unwise actions. Considered a divine guardian or precursor to conscience.",Daimonion (Wikipedia) / Inner Voices (PDF)
Disincarnate Voices,Varied (see notes),"Global (Egyptian, Greek, etc.)","Spiritual, oracular, or psychological phenomena","Voices attributed to deities, spirits, or unconscious minds. Examples include:
- Egyptian oracles (c. 1500 BCE): Priests channeling gods.
- Delphic Oracle (8th–4th c. BCE): Pythia’s trance.",Inner Voices (PDF)
The Head of Orpheus,c. 6th century BCE,Greek Mythology,Posthumous prophecy,"After being dismembered, Orpheus’ severed head continued to sing and prophesy. A symbol of undying artistic and divine power.","Common in Greek myth (e.g., Ovid’s Metamorphoses)"
Mímir’s Head,c. 13th century CE,Norse Mythology,Wisdom and prophecy,"The decapitated head of the god Mímir, preserved by Odin, which whispered secrets and counsel.",Prose Edda (Norse textual sources)
Banshee (Bean Sídhe),c. 8th century CE,Irish Folklore,Death omen,"A disembodied female spirit whose wailing voice foretells death. Not a physical head, but a disincarnate vocal presence.",Irish folklore (common knowledge)
